Sparse Composite Quantization	Ting Zhang, Guo-Jun Qi, Jinhui Tang, Jingdong Wang; Proceedings of the IEEE Conference on Computer Vision and Pattern Recognition (CVPR), 2015, pp. 4548-4556	https://openaccess.thecvf.com/content_cvpr_2015/papers/Zhang_Sparse_Composite_Quantization_2015_CVPR_paper.pdf	The quantization techniques have shown competitive performance in approximate nearest neighbor search. The state-of-the-art algorithm, composite quantization, takes advantage of the compositionabity, i.e., the vector approximation accuracy, as opposed to product quantization and Cartesian k-means. However, we have observed that the runtime cost of computing the distance table in composite quantization, which is used as a lookup table for fast distance computation, becomes nonnegligible in real applications, e.g., reordering the candidates retrieved from the inverted index when handling very large scale databases. To address this problem, we develop a novel approach, called sparse composite quantization, which constructs sparse dictionaries. The benefit is that the distance evaluation between the query and the dictionary element (a sparse vector) is accelerated using the efficient sparse vector operation, and thus the cost of distance table computation is reduced a lot. Experiment results on large scale ANN retrieval tasks (1M SIFTs and 1B SIFTs) and applications to object retrieval show that the proposed approach yields competitive performance: superior search accuracy to product quantization and Cartesian k-means with almost the same computing cost, and much faster ANN search than composite quantization with the same level of accuracy.
Sparse Representation Classification With Manifold Constraints Transfer	Baochang Zhang, Alessandro Perina, Vittorio Murino, Alessio Del Bue; Proceedings of the IEEE Conference on Computer Vision and Pattern Recognition (CVPR), 2015, pp. 4557-4565	https://openaccess.thecvf.com/content_cvpr_2015/papers/Zhang_Sparse_Representation_Classification_2015_CVPR_paper.pdf	The fact that image data samples lie on a manifold has been successfully exploited in many learning and inference problems. In this paper we leverage the specific structure of data in order to improve recognition accuracies in general recognition tasks. In particular we propose a novel framework that allows to embed manifold priors into sparse representation-based classification (SRC) approaches. We also show that manifold constraints can be transferred from the data to the optimized variables if these are linearly correlated. Using this new insight, we define an efficient alternating direction method of multipliers (ADMM) that can consistently integrate the manifold constraints during the optimization process. This is based on the property that we can recast the problem as the projection over the manifold via a linear embedding method based on the Geodesic distance. The proposed approach is successfully applied on face, digit, action and objects recognition showing a consistently increase on performance when compared to the state of the art.
Photometric Stereo With Near Point Lighting: A Solution by Mesh Deformation	Wuyuan Xie, Chengkai Dai, Charlie C. L. Wang; Proceedings of the IEEE Conference on Computer Vision and Pattern Recognition (CVPR), 2015, pp. 4585-4593	https://openaccess.thecvf.com/content_cvpr_2015/papers/Xie_Photometric_Stereo_With_2015_CVPR_paper.pdf	We tackle the problem of photometric stereo under near point lighting in this paper. Different from the conventional formulation of photometric stereo that assumes parallel lighting, photometric stereo under the near point lighting condition is a nonlinear problem as the local surface normals are coupled with its distance to the camera as well as the light sources. To solve this non-linear problem of PS with near point lighting, a local/global mesh deformation approach is developed in our work to determine the position and the orientation of a facet simultaneously, where each facet is corresponding to a pixel in the image captured by the camera. Unlike nonlinear optimization schemes, the mesh deformation in our approach is decoupled into an iteration of interlaced steps of local projection and global blending. Experimental results verify that our method can generate accurate estimation of surface shape under near point lighting in a few iterations. Besides, this approach is robust to errors on the positions of light sources and is easy to be implemented.
Clique-Graph Matching by Preserving Global & Local Structure	Wei-Zhi Nie, An-An Liu, Zan Gao, Yu-Ting Su; Proceedings of the IEEE Conference on Computer Vision and Pattern Recognition (CVPR), 2015, pp. 4503-4510	https://openaccess.thecvf.com/content_cvpr_2015/papers/Nie_Clique-Graph_Matching_by_2015_CVPR_paper.pdf	This paper originally proposes the clique-graph and further presents a clique-graph matching method by preserving global and local structures. Especially, we formulate the objective function of clique-graph matching with respective to two latent variables, the clique information in the original graph and the pairwise clique correspondence constrained by the one-to-one matching. Since the objective function is not jointly convex to both latent variables, we decompose it into two consecutive steps for optimization: 1) clique-to-clique similarity measure by preserving local unary and pairwise correspondences; 2) graph-to-graph similarity measure by preserving global clique-to-clique correspondence. Extensive experiments on the synthetic data and real images show that the proposed method can outperform representative methods especially when both noise and outliers exist.
Real-Time 3D Head Pose and Facial Landmark Estimation From Depth Images Using Triangular Surface Patch Features	Chavdar Papazov, Tim K. Marks, Michael Jones; Proceedings of the IEEE Conference on Computer Vision and Pattern Recognition (CVPR), 2015, pp. 4722-4730	https://openaccess.thecvf.com/content_cvpr_2015/papers/Papazov_Real-Time_3D_Head_2015_CVPR_paper.pdf	We present a real-time system for 3D head pose estimation and facial landmark localization using a commodity depth sensor. We introduce a novel triangular surface patch (TSP) descriptor, which encodes the shape of the 3D surface of the face within a triangular area. The proposed descriptor is viewpoint invariant, and it is robust to noise and to variations in the data resolution. Using a fast nearest neighbor lookup, TSP descriptors from an input depth map are matched to the most similar ones that were computed from synthetic head models in a training phase. The matched triangular surface patches in the training set are used to compute estimates of the 3D head pose and facial landmark positions in the input depth map. By sampling many TSP descriptors, many votes for pose and landmark positions are generated which together yield robust final estimates.  We evaluate our approach on the publicly available Biwi Kinect Head Pose Database to compare it against state-of-the-art methods. Our results show a significant improvement in the accuracy of both pose and landmark location estimates while maintaining real-time speed.
Superpixel-Based Video Object Segmentation Using Perceptual Organization and Location Prior	Daniela Giordano, Francesca Murabito, Simone Palazzo, Concetto Spampinato; Proceedings of the IEEE Conference on Computer Vision and Pattern Recognition (CVPR), 2015, pp. 4814-4822	https://openaccess.thecvf.com/content_cvpr_2015/papers/Giordano_Superpixel-Based_Video_Object_2015_CVPR_paper.pdf	In this paper we present an approach for segmenting objects in videos taken in complex scenes with multiple and different targets. The method does not make any specific assumptions about the videos and relies on how objects are perceived by humans according to Gestalt laws. Initially, we rapidly generate a coarse foreground segmentation, which provides predictions about motion regions by analyzing how superpixel segmentation changes in consecutive frames. We then exploit these location priors to refine the initial segmentation by optimizing an energy function based on appearance and perceptual organization, only on regions where motion is observed.  We evaluated our method on complex and challenging video sequences and it showed significant performance improvements over recent state-of-the-art methods, being also fast enough to be used for "on-the-fly" processing.
Transport-Based Single Frame Super Resolution of Very Low Resolution Face Images	Soheil Kolouri, Gustavo K. Rohde; Proceedings of the IEEE Conference on Computer Vision and Pattern Recognition (CVPR), 2015, pp. 4876-4884	https://openaccess.thecvf.com/content_cvpr_2015/papers/Kolouri_Transport-Based_Single_Frame_2015_CVPR_paper.pdf	Extracting high-resolution information from highly degraded facial images is an important problem with several applications in science and technology. Here we describe a single frame super resolution technique that uses a transport-based formulation of the problem. The method consists of a training and a testing phase. In the training phase, a nonlinear Lagrangian model of high-resolution facial appearance is constructed fully automatically. In the testing phase,  the resolution of a degraded image is enhanced by finding the model parameters that best fit the given low resolution data. We test the approach on two face datasets, namely the extended Yale Face Database B and the AR face datasets, and compare it to state of the art methods. The proposed method  outperforms existing solutions in problems related to enhancing images of very low resolution.
High-Speed Hyperspectral Video Acquisition With a Dual-Camera Architecture	Lizhi Wang, Zhiwei Xiong, Dahua Gao, Guangming Shi, Wenjun Zeng, Feng Wu; Proceedings of the IEEE Conference on Computer Vision and Pattern Recognition (CVPR), 2015, pp. 4942-4950	https://openaccess.thecvf.com/content_cvpr_2015/papers/Wang_High-Speed_Hyperspectral_Video_2015_CVPR_paper.pdf	We propose a novel dual-camera design to acquire 4D high-speed hyperspectral (HSHS) videos with high spatial and spectral resolution. Our work has two key technical contributions. First, we build a dual-camera system that simultaneously captures a panchromatic video at a high frame rate and a hyperspectral video at a low frame rate, which jointly provide reliable projections for the underlying HSHS video. Second, we exploit the panchromatic video to learn an over-complete 3D dictionary to represent each band-wise video sparsely, and a robust computational reconstruction is then employed to recover the HSHS video based on the joint videos and the self-learned dictionary. Experimental results demonstrate that, for the first time to our knowledge, the hyperspectral video frame rate reaches up to 100fps with decent quality, even when the incident light is not strong.
Understanding Deep Image Representations by Inverting Them	Aravindh Mahendran, Andrea Vedaldi; Proceedings of the IEEE Conference on Computer Vision and Pattern Recognition (CVPR), 2015, pp. 5188-5196	https://openaccess.thecvf.com/content_cvpr_2015/papers/Mahendran_Understanding_Deep_Image_2015_CVPR_paper.pdf	Image representations, from SIFT and Bag of Visual Words to Convolutional Neural Networks (CNNs), are a crucial component of almost any image understanding system. Nevertheless, our understanding of them remains limited. In this paper we conduct a direct analysis of the visual information contained in representations by asking the following question: given an encoding of an image, to which extent is it possible to reconstruct the image itself? To answer this question we contribute a general framework to invert representations. We show that this method can invert representations such as HOG more accurately than recent alternatives while being applicable to CNNs too. We then use this technique to study the inverse of recent state-of-the-art CNN image representations for the first time. Among our findings, we show that several layers in CNNs retain photographically accurate information about the image, with different degrees of geometric and photometric invariance.
A Weighted Sparse Coding Framework for Saliency Detection	Nianyi Li, Bilin Sun, Jingyi Yu; Proceedings of the IEEE Conference on Computer Vision and Pattern Recognition (CVPR), 2015, pp. 5216-5223	https://openaccess.thecvf.com/content_cvpr_2015/papers/Li_A_Weighted_Sparse_2015_CVPR_paper.pdf	There is an emerging interest on using high-dimensional datasets beyond 2D images in saliency detection. Examples include 3D data based on stereo matching and Kinect sensors and more recently 4D light field data. However, these techniques adopt very different solution frameworks, in both type of features and procedures on using them. In this paper, we present a unified saliency detection framework for handling heterogenous types of input data. Our approach builds dictionaries using data-specific features. Specifically, we first select a group of potential background superpixels to build a primitive non-saliency dictionary. We then prune the outliers in the dictionary and test on the remaining superpixels to iteratively refine the dictionary. Comprehensive experiments show that our approach universally outperforms the state-of-the-art solution on all 2D, 3D and 4D data.
Robust Multi-Image Based Blind Face Hallucination	Yonggang Jin, Christos-Savvas Bouganis; Proceedings of the IEEE Conference on Computer Vision and Pattern Recognition (CVPR), 2015, pp. 5252-5260	https://openaccess.thecvf.com/content_cvpr_2015/papers/Jin_Robust_Multi-Image_Based_2015_CVPR_paper.pdf	This paper proposes a robust multi-image based blind face hallucination framework to super-resolve LR faces. The proposed framework first estimates both blurring kernel and transformations of multiple LR faces by robust deblurring and registration in PCA subspace. A patch-wise mixture of probabilistic PCA prior is then incorporated for face super-resolution. Previous work on face SR using PCA prior can be viewed as special cases of the framework. Experimental results in both simulated and real LR sequences demonstrate very promising performance of the proposed method.
