Variational Prototype Learning for Deep Face Recognition	Jiankang Deng, Jia Guo, Jing Yang, Alexandros Lattas, Stefanos Zafeiriou; Proceedings of the IEEE/CVF Conference on Computer Vision and Pattern Recognition (CVPR), 2021, pp. 11906-11915	https://openaccess.thecvf.com/content/CVPR2021/papers/Deng_Variational_Prototype_Learning_for_Deep_Face_Recognition_CVPR_2021_paper.pdf	Deep face recognition has achieved remarkable improvements due to the introduction of margin-based softmax loss, in which the prototype stored in the last linear layer represents the center of each class. In these methods, training samples are enforced to be close to positive prototypes and far apart from negative prototypes by a clear margin. However, we argue that prototype learning only employs sample-to-prototype comparisons without considering sample-to-sample comparisons during training and the low loss value gives us an illusion of perfect feature embedding, impeding the further exploration of SGD. To this end, we propose Variational Prototype Learning (VPL), which represents every class as a distribution instead of a point in the latent space. By identifying the slow feature drift phenomenon, we directly inject memorized features into prototypes to approximate variational prototype sampling. The proposed VPL can simulate sample-to-sample comparisons within the classification framework, encouraging the SGD solver to be more exploratory, while boosting performance. Moreover, VPL is conceptually simple, easy to implement, computationally efficient and memory saving. We present extensive experimental results on popular benchmarks, which demonstrate the superiority of the proposed VPL method over the state-of-the-art competitors.
High-Fidelity Face Tracking for AR/VR via Deep Lighting Adaptation	Lele Chen, Chen Cao, Fernando De la Torre, Jason Saragih, Chenliang Xu, Yaser Sheikh; Proceedings of the IEEE/CVF Conference on Computer Vision and Pattern Recognition (CVPR), 2021, pp. 13059-13069	https://openaccess.thecvf.com/content/CVPR2021/papers/Chen_High-Fidelity_Face_Tracking_for_ARVR_via_Deep_Lighting_Adaptation_CVPR_2021_paper.pdf	3D video avatars can empower virtual communications by providing compression, privacy, entertainment, and a sense of presence in AR/VR. Best 3D photo-realistic AR/VR avatars driven by video, that can minimize uncanny effects, rely on person-specific models. However, existing person-specific photo-realistic 3D models are not robust to lighting, hence their results typically miss subtle facial behaviors and cause artifacts in the avatar. This is a major drawback for the scalability of these models in communication systems (e.g., Messenger, Skype, FaceTime) and AR/VR. This paper addresses previous limitations by learning a deep learning lighting model, that in combination with a high-quality 3D face tracking algorithm, provides a method for subtle and robust facial motion transfer from a regular video to a 3D photo-realistic avatar. Extensive experimental validation and comparisons to other state-of-the-art methods demonstrate the effectiveness of the proposed framework in real-world scenarios with variability in pose, expression, and illumination. Our project page can be found at https://www.cs.rochester.edu/ cxu22/r/wild-avatar/.
Towards High Fidelity Face Relighting With Realistic Shadows	Andrew Hou, Ze Zhang, Michel Sarkis, Ning Bi, Yiying Tong, Xiaoming Liu; Proceedings of the IEEE/CVF Conference on Computer Vision and Pattern Recognition (CVPR), 2021, pp. 14719-14728	https://openaccess.thecvf.com/content/CVPR2021/papers/Hou_Towards_High_Fidelity_Face_Relighting_With_Realistic_Shadows_CVPR_2021_paper.pdf	Existing face relighting methods often struggle with two problems: maintaining the local facial details of the subject and accurately removing and synthesizing shadows in the relit image, especially hard shadows. We propose a novel deep face relighting method that addresses both problems. Our method learns to predict the ratio (quotient) image between a source image and the target image with the desired lighting, allowing us to relight the image while maintaining the local facial details. During training, our model also learns to accurately modify shadows by using estimated shadow masks to emphasize on the high-contrast shadow borders. Furthermore, we introduce a method to use the shadow mask to estimate the ambient light intensity in an image, and are thus able to leverage multiple datasets during training with different global lighting intensities. With quantitative and qualitative evaluations on the Multi-PIE and FFHQ datasets, we demonstrate that our proposed method faithfully maintains the local facial details of the subject and can accurately handle hard shadows while achieving state-of-the-art face relighting performance.
Progressive Semantic-Aware Style Transformation for Blind Face Restoration	Chaofeng Chen, Xiaoming Li, Lingbo Yang, Xianhui Lin, Lei Zhang, Kwan-Yee K. Wong; Proceedings of the IEEE/CVF Conference on Computer Vision and Pattern Recognition (CVPR), 2021, pp. 11896-11905	https://openaccess.thecvf.com/content/CVPR2021/papers/Chen_Progressive_Semantic-Aware_Style_Transformation_for_Blind_Face_Restoration_CVPR_2021_paper.pdf	Face restoration is important in face image processing, and has been widely studied in recent years. However, previous works often fail to generate plausible high quality (HQ) results for real-world low quality (LQ) face images. In this paper, we propose a new progressive semantic-aware style transformation framework, named PSFR-GAN, for face restoration. Specifically, instead of using an encoder-decoder framework as previous methods, we formulate the restoration of LQ face images as a multi-scale progressive restoration procedure through semantic-aware style transformation. Given a pair of LQ face image and its corresponding parsing map, we first generate a multi-scale pyramid of the inputs, and then progressively modulate different scale features from coarse-to-fine in a semantic-aware style transfer way. Compared with previous networks, the proposed PSFR-GAN makes full use of the semantic (parsing maps) and pixel (LQ images) space information from different scales of input pairs. In addition, we further introduce a semantic aware style loss which calculates the feature style loss for each semantic region individually to improve the details of face textures. Finally, we pretrain a face parsing network which can generate decent parsing maps from real-world LQ face images. Experiment results show that our model trained with synthetic data can produce more realistic high-resolution results for synthetic LQ inputs than state-of-the-art methods and generalize better to natural LQ face images.
Cross-Domain Similarity Learning for Face Recognition in Unseen Domains	Masoud Faraki, Xiang Yu, Yi-Hsuan Tsai, Yumin Suh, Manmohan Chandraker; Proceedings of the IEEE/CVF Conference on Computer Vision and Pattern Recognition (CVPR), 2021, pp. 15292-15301	https://openaccess.thecvf.com/content/CVPR2021/papers/Faraki_Cross-Domain_Similarity_Learning_for_Face_Recognition_in_Unseen_Domains_CVPR_2021_paper.pdf	Face recognition models trained under the assumption of identical training and test distributions often suffer from poor generalization when faced with unknown variations, such as a novel ethnicity or unpredictable individual make-ups during test time. In this paper, we introduce a novel cross-domain metric learning loss, which we dub Cross-Domain Triplet (CDT) loss, to improve face recognition in unseen domains. The CDT loss encourages learning semantically meaningful features by enforcing compact feature clusters of identities from one domain, where the compactness is measured by underlying similarity metrics that belong to another training domain with different statistics. Intuitively, it discriminatively correlates explicit metrics derived from one domain, with triplet samples from another domain in a unified loss function to be minimized within a network, which leads to better alignment of the training domains. The network parameters are further enforced to learn generalized features under domain shift, in a model-agnostic learning pipeline. Unlike the recent work of Meta Face Recognition, our method does not require careful hard-pair sample mining and filtering strategy during training. Extensive experiments on various face recognition benchmarks show the superiority of our method in handling variations, compared to baseline methods and the state-of-the-arts.
Virtual Fully-Connected Layer: Training a Large-Scale Face Recognition Dataset With Limited Computational Resources	Pengyu Li, Biao Wang, Lei Zhang; Proceedings of the IEEE/CVF Conference on Computer Vision and Pattern Recognition (CVPR), 2021, pp. 13315-13324	https://openaccess.thecvf.com/content/CVPR2021/papers/Li_Virtual_Fully-Connected_Layer_Training_a_Large-Scale_Face_Recognition_Dataset_With_CVPR_2021_paper.pdf	Recently, deep face recognition has achieved significant progress because of Convolutional Neural Networks (CNNs) and large-scale datasets. However, training CNNs on a large-scale face recognition dataset with limited computational resources is still a challenge. This is because the classification paradigm needs to train a fully connected layer as the category classifier, and its parameters will be in the hundreds of millions if the training dataset contains millions of identities. This requires many computational resources, such as GPU memory. The metric learning paradigm is an economical computation method, but its performance is greatly inferior to that of the classification paradigm. To address this challenge, we propose a simple but effective CNN layer called the Virtual fully connected (Virtual FC) layer to reduce the computational consumption of the classification paradigm. Without bells and whistles, the proposed Virtual FC reduces the parameters by more than 100 times with respect to the fully connected layer and achieves competitive performance on mainstream face recognition evaluation datasets. Moreover, the performance of our Virtual FC layer on the evaluation datasets is superior to that of the metric learning paradigm by a significant margin. Our code will be released in hopes of disseminating our idea to other domains.
BRepNet: A Topological Message Passing System for Solid Models	Joseph G. Lambourne, Karl D.D. Willis, Pradeep Kumar Jayaraman, Aditya Sanghi, Peter Meltzer, Hooman Shayani; Proceedings of the IEEE/CVF Conference on Computer Vision and Pattern Recognition (CVPR), 2021, pp. 12773-12782	https://openaccess.thecvf.com/content/CVPR2021/papers/Lambourne_BRepNet_A_Topological_Message_Passing_System_for_Solid_Models_CVPR_2021_paper.pdf	Boundary representation (B-rep) models are the standard way 3D shapes are described in Computer-Aided Design (CAD) applications. They combine lightweight parametric curves and surfaces with topological information which connects the geometric entities to describe manifolds. In this paper we introduce BRepNet, a neural network architecture designed to operate directly on B-rep data structures, avoiding the need to approximate the model as meshes or point clouds. BRepNet defines convolutional kernels with respect to oriented coedges in the data structure. In the neighborhood of each coedge, a small collection of faces, edges and coedges can be identified and patterns in the feature vectors from these entities detected by specific learnable parameters. In addition, to encourage further deep learning research with B-reps, we publish the Fusion 360 Gallery segmentation dataset. A collection of over 35,000 B-rep models annotated with information about the modeling operations which created each face. We demonstrate that BRepNet can segment these models with higher accuracy than methods working on meshes, and point clouds.
Improving Transferability of Adversarial Patches on Face Recognition With Generative Models	Zihao Xiao, Xianfeng Gao, Chilin Fu, Yinpeng Dong, Wei Gao, Xiaolu Zhang, Jun Zhou, Jun Zhu; Proceedings of the IEEE/CVF Conference on Computer Vision and Pattern Recognition (CVPR), 2021, pp. 11845-11854	https://openaccess.thecvf.com/content/CVPR2021/papers/Xiao_Improving_Transferability_of_Adversarial_Patches_on_Face_Recognition_With_Generative_CVPR_2021_paper.pdf	Face recognition is greatly improved by deep convolutional neural networks (CNNs). Recently, these face recognition models have been used for identity authentication in security sensitive applications. However, deep CNNs are vulnerable to adversarial patches, which are physically realizable and stealthy, raising new security concerns on the real-world applications of these models. In this paper, we evaluate the robustness of face recognition models using adversarial patches based on transferability, where the attacker has limited accessibility to the target models. First, we extend the existing transfer-based attack techniques to generate transferable adversarial patches. However, we observe that the transferability is sensitive to initialization and degrades when the perturbation magnitude is large, indicating the overfitting to the substitute models. Second, we propose to regularize the adversarial patches on the low dimensional data manifold. The manifold is represented by generative models pre-trained on legitimate human face images. Using face-like features as adversarial perturbations through optimization on the manifold, we show that the gaps between the responses of substitute models and the target models dramatically decrease, exhibiting a better transferability. Extensive digital world experiments are conducted to demonstrate the superiority of the proposed method in the black-box setting. We apply the proposed method in the physical world as well.
FaceSec: A Fine-Grained Robustness Evaluation Framework for Face Recognition Systems	Liang Tong, Zhengzhang Chen, Jingchao Ni, Wei Cheng, Dongjin Song, Haifeng Chen, Yevgeniy Vorobeychik; Proceedings of the IEEE/CVF Conference on Computer Vision and Pattern Recognition (CVPR), 2021, pp. 13254-13263	https://openaccess.thecvf.com/content/CVPR2021/papers/Tong_FaceSec_A_Fine-Grained_Robustness_Evaluation_Framework_for_Face_Recognition_Systems_CVPR_2021_paper.pdf	We present FACESEC, a framework for fine-grained robustness evaluation of face recognition systems. FACESEC evaluation is performed along four dimensions of adversarial modeling: the nature of perturbation (e.g., pixel-level or face accessories), the attacker's system knowledge (about training data and learning architecture), goals (dodging or impersonation), and capability (tailored to individual inputs or across sets of these). We use FACESEC to study five face recognition systems in both closed-set and open-set settings, and to evaluate the state-of-the-art approach for defending against physically realizable attacks on these. We find that accurate knowledge of neural architecture is significantly more important than knowledge of the training data in black-box attacks. Moreover, we observe that open-set face recognition systems are more vulnerable than closed-set systems under different types of attacks. The efficacy of attacks for other threat model variations, however, appears highly dependent on both the nature of perturbation and the neural network architecture. For example, attacks that involve adversarial face masks are usually more potent, even against adversarially trained models, and the ArcFace architecture tends to be more robust than the others.
Learning To Aggregate and Personalize 3D Face From In-the-Wild Photo Collection	Zhenyu Zhang, Yanhao Ge, Renwang Chen, Ying Tai, Yan Yan, Jian Yang, Chengjie Wang, Jilin Li, Feiyue Huang; Proceedings of the IEEE/CVF Conference on Computer Vision and Pattern Recognition (CVPR), 2021, pp. 14214-14224	https://openaccess.thecvf.com/content/CVPR2021/papers/Zhang_Learning_To_Aggregate_and_Personalize_3D_Face_From_In-the-Wild_Photo_CVPR_2021_paper.pdf	Non-prior face modeling aims to reconstruct 3D face only from images without shape assumptions. While plausible facial details are predicted, the models tend to over-depend on local color appearance and suffer from ambiguous noise. To address such problem, this paper presents a novel Learning to Aggregate and Personalize (LAP) framework for unsupervised robust 3D face modeling. Instead of using controlled environment, the proposed method implicitly disentangles ID-consistent and scene-specific face from unconstrained photo set. Specifically, to learn ID-consistent face, LAP adaptively aggregates intrinsic face factors of an identity based on a novel curriculum learning approach with relaxed consistency loss. To adapt the face for a personalized scene, we propose a novel attribute-refining network to modify ID-consistent face with target attribute and details. Based on the proposed method, we make unsupervised 3D face modeling benefit from meaningful image facial structure and possibly higher resolutions. Extensive experiments on benchmarks show LAP recovers superior or competitive face shape and texture, compared with state-of-the-art (SOTA) methods with or without prior and supervision.
Learning Spatial-Semantic Relationship for Facial Attribute Recognition With Limited Labeled Data	Ying Shu, Yan Yan, Si Chen, Jing-Hao Xue, Chunhua Shen, Hanzi Wang; Proceedings of the IEEE/CVF Conference on Computer Vision and Pattern Recognition (CVPR), 2021, pp. 11916-11925	https://openaccess.thecvf.com/content/CVPR2021/papers/Shu_Learning_Spatial-Semantic_Relationship_for_Facial_Attribute_Recognition_With_Limited_Labeled_CVPR_2021_paper.pdf	Recent advances in deep learning have demonstrated excellent results for Facial Attribute Recognition (FAR), typically trained with large-scale labeled data. However, in many real-world FAR applications, only limited labeled data are available, leading to remarkable deterioration in performance for most existing deep learning-based FAR methods. To address this problem, here we propose a method termed Spatial-Semantic Patch Learning (SSPL). The training of SSPL involves two stages. First, three auxiliary tasks, consisting of a Patch Rotation Task (PRT), a Patch Segmentation Task (PST), and a Patch Classification Task (PCT), are jointly developed to learn the spatial-semantic relationship from large-scale unlabeled facial data. We thus obtain a powerful pre-trained model. In particular, PRT exploits the spatial information of facial images in a self-supervised learning manner. PST and PCT respectively capture the pixel-level and image-level semantic information of facial images based on a facial parsing model. Second, the spatial-semantic knowledge learned from auxiliary tasks is transferred to the FAR task. By doing so, it enables that only a limited number of labeled data are required to fine-tune the pre-trained model. We achieve superior performance compared with state-of-the-art methods, as substantiated by extensive experiments and studies.
Normalized Avatar Synthesis Using StyleGAN and Perceptual Refinement	Huiwen Luo, Koki Nagano, Han-Wei Kung, Qingguo Xu, Zejian Wang, Lingyu Wei, Liwen Hu, Hao Li; Proceedings of the IEEE/CVF Conference on Computer Vision and Pattern Recognition (CVPR), 2021, pp. 11662-11672	https://openaccess.thecvf.com/content/CVPR2021/papers/Luo_Normalized_Avatar_Synthesis_Using_StyleGAN_and_Perceptual_Refinement_CVPR_2021_paper.pdf	We introduce a highly robust GAN-based framework for digitizing a normalized 3D avatar of a person from a single unconstrained photo. While the input image can be of a smiling person or taken in extreme lighting conditions, our method can reliably produce a high-quality textured model of a person's face in neutral expression and skin textures under diffuse lighting condition. Cutting-edge 3D face reconstruction methods use non-linear morphable face models combined with GAN-based decoders to capture the likeness and details of a person but fail to produce neutral head models with unshaded albedo textures which is critical for creating relightable and animation-friendly avatars for integration in virtual environments. The key challenges for existing methods to work is the lack of training and ground truth data containing normalized 3D faces. We propose a two-stage approach to address this problem. First, we adopt a highly robust normalized 3D face generator by embedding a non-linear morphable face model into a StyleGAN2 network. This allows us to generate detailed but normalized facial assets. This inference is then followed by a perceptual refinement step that uses the generated assets as regularization to cope with the limited available training samples of normalized faces. We further introduce a Normalized Face Dataset, which consists of a combination photogrammetry scans, carefully selected photographs, and generated fake people with neutral expressions in diffuse lighting conditions. While our prepared dataset contains two orders of magnitude less subjects than cutting edge GAN-based 3D facial reconstruction methods, we show that it is possible to produce high-quality normalized face models for very challenging unconstrained input images, and demonstrate superior performance to the current state-of-the-art.
Quality-Agnostic Image Recognition via Invertible Decoder	Insoo Kim, Seungju Han, Ji-won Baek, Seong-Jin Park, Jae-Joon Han, Jinwoo Shin; Proceedings of the IEEE/CVF Conference on Computer Vision and Pattern Recognition (CVPR), 2021, pp. 12257-12266	https://openaccess.thecvf.com/content/CVPR2021/papers/Kim_Quality-Agnostic_Image_Recognition_via_Invertible_Decoder_CVPR_2021_paper.pdf	Despite the remarkable performance of deep models on image recognition tasks, they are known to be susceptible to common corruptions such as blur, noise, and low-resolution. Data augmentation is a conventional way to build a robust model by considering these common corruptions during the training. However, a naive data augmentation scheme may result in a non-specialized model for particular corruptions, as the model tends to learn the averaged distribution among corruptions. To mitigate the issue, we propose a new paradigm of training deep image recognition networks that produce clean-like features from any quality image via an invertible neural architecture. The proposed method consists of two stages. In the first stage, we train an invertible network with only clean images under the recognition objective. In the second stage, its inversion, i.e., the invertible decoder, is attached to a new recognition network and we train this encoder-decoder network using both clean and corrupted images by considering recognition and reconstruction objectives. Our two-stage scheme allows the network to produce clean-like and robust features from any quality images, by reconstructing their clean images via the invertible decoder. We demonstrate the effectiveness of our method on image classification and face recognition tasks.
IronMask: Modular Architecture for Protecting Deep Face Template	Sunpill Kim, Yunseong Jeong, Jinsu Kim, Jungkon Kim, Hyung Tae Lee, Jae Hong Seo; Proceedings of the IEEE/CVF Conference on Computer Vision and Pattern Recognition (CVPR), 2021, pp. 16125-16134	https://openaccess.thecvf.com/content/CVPR2021/papers/Kim_IronMask_Modular_Architecture_for_Protecting_Deep_Face_Template_CVPR_2021_paper.pdf	Convolutional neural networks have made remarkable progress in the face recognition field. The more the technology of face recognition advances, the greater discriminative features into a face template. However, this increases the threat to user privacy in case the template is exposed. In this paper, we present a modular architecture for face template protection, called IronMask, that can be combined with any face recognition system using angular distance metric. We circumvent the need for binarization, which is the main cause of performance degradation in most existing face template protections, by proposing a new real-valued error-correcting-code that is compatible with real-valued templates and can therefore, minimize performance degradation. We evaluate the efficacy of IronMask by extensive experiments on two face recognitions, ArcFace and CosFace with three datasets, CMU-Multi-PIE, FEI, and Color-FERET. According to our experimental results, IronMask achieves a true accept rate (TAR) of 99.79% at a false accept rate (FAR) of 0.0005% when combined with ArcFace, and 95.78% TAR at 0% FAR with CosFace, while providing at least 115-bit security against known attacks.
