Automatic Construction Of Robust Spherical Harmonic Subspaces	Patrick Snape, Yannis Panagakis, Stefanos Zafeiriou; Proceedings of the IEEE Conference on Computer Vision and Pattern Recognition (CVPR), 2015, pp. 91-100	https://openaccess.thecvf.com/content_cvpr_2015/papers/Snape_Automatic_Construction_Of_2015_CVPR_paper.pdf	In this paper we propose a method to automatically recover a class specific low dimensional spherical harmonic basis from a set of in-the-wild facial images. We combine existing techniques for uncalibrated photometric stereo and low rank matrix decompositions in order to robustly recover a combined model of shape and identity. We build this basis without aid from a 3D model and show how it can be combined with recent efficient sparse facial feature localisation techniques to recover dense 3D facial shape. Unlike previous works in the area, our method is very efficient and is an order of magnitude faster to train, taking only a few minutes to build a model with over 2000 images. Furthermore, it can be used for real-time recovery of facial shape.
Projection Metric Learning on Grassmann Manifold With Application to Video Based Face Recognition	Zhiwu Huang, Ruiping Wang, Shiguang Shan, Xilin Chen; Proceedings of the IEEE Conference on Computer Vision and Pattern Recognition (CVPR), 2015, pp. 140-149	https://openaccess.thecvf.com/content_cvpr_2015/papers/Huang_Projection_Metric_Learning_2015_CVPR_paper.pdf	In video based face recognition, great success has been made by representing videos as linear subspaces, which typically lie in a special type of non-Euclidean space known as Grassmann manifold. To leverage the kernel-based methods developed for Euclidean space, several recent methods have been proposed to embed the Grassmann manifold into a high dimensional Hilbert space by exploiting the well established Project Metric, which can approximate the Riemannian geometry of Grassmann manifold. Nevertheless, they inevitably introduce the drawbacks from traditional kernel-based methods such as implicit map and high computational cost to the Grassmann manifold. To overcome such limitations, we propose a novel method to learn the Projection Metric directly on Grassmann manifold rather than in Hilbert space. From the perspective of manifold learning, our method can be regarded as performing a geometry-aware dimensionality reduction from the original Grassmann manifold to a lower-dimensional, more discriminative Grassmann manifold  where more favorable classification can be achieved. Experiments on several real-world video face datasets demonstrate that the proposed method yields competitive performance compared with the state-of-the-art algorithms.
Shape Driven Kernel Adaptation in Convolutional Neural Network for Robust Facial Traits Recognition	Shaoxin Li, Junliang Xing, Zhiheng Niu, Shiguang Shan, Shuicheng Yan; Proceedings of the IEEE Conference on Computer Vision and Pattern Recognition (CVPR), 2015, pp. 222-230	https://openaccess.thecvf.com/content_cvpr_2015/papers/Li_Shape_Driven_Kernel_2015_CVPR_paper.pdf	One key challenge of facial traits recognition is the large non-rigid appearance variations due to irrelevant real world factors, such as viewpoint and expression changes. In this paper, we explore how the shape information, i.e. facial landmark positions, can be explicitly deployed into the popular Convolutional Neural Network (CNN) architecture to disentangling such irrelevant non-rigid appearance variations. First, instead of using fixed kernels, we propose a kernel adaptation method to dynamically determine the convolutional kernels according to the distribution of facial landmarks, which helps learning more robust features. Second, motivated by the intuition that different local facial regions may demand different adaptation functions, we further propose a tree-structured convolutional architecture to hierarchically fuse multiple local adaptive CNN subnetworks. Comprehensive experiments on WebFace, Morph II and MultiPIE databases well validate the effectiveness of the proposed kernel adaptation method and tree-structured convolutional architecture for facial traits recognition tasks, including identity, age and gender classification. For all the tasks, the proposed architecture consistently achieves the state-of-the-art performances.
Privacy Preserving Optics for Miniature Vision Sensors	Francesco Pittaluga, Sanjeev J. Koppal; Proceedings of the IEEE Conference on Computer Vision and Pattern Recognition (CVPR), 2015, pp. 314-324	https://openaccess.thecvf.com/content_cvpr_2015/papers/Pittaluga_Privacy_Preserving_Optics_2015_CVPR_paper.pdf	The next wave of micro and nano devices will create a world with trillions of small networked cameras. This will lead to increased concerns about privacy and security. Most privacy preserving algorithms for computer vision are applied after image/video data has been captured. We propose to use privacy preserving optics that filter or block sensitive information directly from the incident light-field before sensor measurements are made, adding a new layer of privacy. In addition to balancing the privacy and utility of the captured data, we address trade-offs unique to miniature vision sensors, such as achieving high-quality field-of-view and resolution within the constraints of mass and volume. Our privacy preserving optics enable applications such as depth sensing, full-body motion tracking, people counting, blob detection and privacy preserving face recognition. While we demonstrate applications on macro-scale devices (smartphones, webcams, etc.) our theory has impact for smaller devices.
Efficient Minimal-Surface Regularization of Perspective Depth Maps in Variational Stereo	Gottfried Graber, Jonathan Balzer, Stefano Soatto, Thomas Pock; Proceedings of the IEEE Conference on Computer Vision and Pattern Recognition (CVPR), 2015, pp. 511-520	https://openaccess.thecvf.com/content_cvpr_2015/papers/Graber_Efficient_Minimal-Surface_Regularization_2015_CVPR_paper.pdf	We propose a method for dense three-dimensional surface reconstruction that leverages the strengths of shape-based approaches, by imposing regularization that respects the geometry of the surface, and the strength of depth-map-based stereo, by avoiding costly computation of surface topology. The result is a near real-time variational reconstruction algorithm free of the staircasing artifacts that affect depth-map and plane-sweeping approaches. This is made possible by exploiting the gauge ambiguity to design a novel representation of the regularizer that is linear in the parameters and hence amenable to be optimized with state-of-the-art primal-dual numerical schemes.
Rotating Your Face Using Multi-Task Deep Neural Network	Junho Yim, Heechul Jung, ByungIn Yoo, Changkyu Choi, Dusik Park, Junmo Kim; Proceedings of the IEEE Conference on Computer Vision and Pattern Recognition (CVPR), 2015, pp. 676-684	https://openaccess.thecvf.com/content_cvpr_2015/papers/Yim_Rotating_Your_Face_2015_CVPR_paper.pdf	Face recognition under viewpoint and illumination changes is a difficult problem, so many researchers have tried to solve this problem by producing the pose- and illumination- invariant feature. Zhu et al. [26] changed all arbitrary pose and illumination images to the frontal view image to use for the invariant feature. In this scheme, preserving identity while rotating pose image is a crucial issue. This paper proposes a new deep architecture based on a novel type of multitask learning, which can achieve superior performance in rotating to a target-pose face image from an arbitrary pose and illumination image while preserving identity. The target pose can be controlled by the user's intention. This novel type of multi-task model significantly improves identity preservation over the single task model. By using all the synthesized controlled pose images, called Controlled Pose Image (CPI), for the pose- illumination- invariant feature and voting among the multiple face recognition results, we clearly outperform the state-of-the-art algorithms by more than 4~6% on the MultiPIE dataset.
in the Proceedings of the IEEE Conference on Computer Vision and Pattern Recognition (CVPR), June 2013, pp. 1067-1074
MUlti-Store Tracker (MUSTer): A Cognitive Psychology Inspired Approach to Object Tracking	Zhibin Hong, Zhe Chen, Chaohui Wang, Xue Mei, Danil Prokhorov, Dacheng Tao; Proceedings of the IEEE Conference on Computer Vision and Pattern Recognition (CVPR), 2015, pp. 749-758	https://openaccess.thecvf.com/content_cvpr_2015/papers/Hong_MUlti-Store_Tracker_MUSTer_2015_CVPR_paper.pdf	Variations in the appearance of a tracked object, such as changes in geometry/photometry, camera viewpoint, illumination, or partial occlusion, pose a major challenge to object tracking. Here, we adopt cognitive psychology principles to design a flexible representation that can adapt to changes in object appearance during tracking. Inspired by the well-known Atkinson-Shiffrin Memory Model, we propose MUlti-Store Tracker (MUSTer), a dual-component approach consisting of short- and long-term memory stores to process target appearance memories. A powerful and efficient Integrated Correlation Filter (ICF) is employed in the short-term store for short-term tracking. The integrated long-term component, which is based on keypoint matching-tracking and RANSAC estimation, can interact with the long-term memory and provide additional information for output control. MUSTer was extensively evaluated on the CVPR2013 Online Object Tracking Benchmark (OOTB) and ALOV++ datasets. The experimental results demonstrated the superior performance of MUSTer in comparison with other state-of-art trackers.
Semantic Part Segmentation Using Compositional Model Combining Shape and Appearance	Jianyu Wang, Alan L. Yuille; Proceedings of the IEEE Conference on Computer Vision and Pattern Recognition (CVPR), 2015, pp. 1788-1797	https://openaccess.thecvf.com/content_cvpr_2015/papers/Wang_Semantic_Part_Segmentation_2015_CVPR_paper.pdf	In this paper, we study the problem of semantic part segmentation for animals. This is more challenging than standard object detection, object segmentation and pose estimation tasks because semantic parts of animals often have similar appearance and highly varying shapes. To tackle these challenges, we build a mixture of compositional models to represent the object boundary and the boundaries of semantic parts. And we incorporate edge, appearance, and semantic part cues into the compositional model. Given part-level segmentation annotation, we develop a novel algorithm to learn a mixture of compositional models under various poses and viewpoints for certain animal classes. Furthermore, a linear complexity algorithm is offered for efficient inference of the compositional model using dynamic programming. We evaluate our method for horse and cow using a newly annotated dataset on Pascal VOC 2010 which has pixelwise part labels. Experimental results demonstrate the effectiveness of our method.
From Image-Level to Pixel-Level Labeling With Convolutional Networks	Pedro O. Pinheiro, Ronan Collobert; Proceedings of the IEEE Conference on Computer Vision and Pattern Recognition (CVPR), 2015, pp. 1713-1721	https://openaccess.thecvf.com/content_cvpr_2015/papers/Pinheiro_From_Image-Level_to_2015_CVPR_paper.pdf	We are interested in inferring object segmentation by leveraging only object class information, and by considering only minimal priors on the object segmentation task. This problem could be viewed as a kind of weakly supervised segmentation task, and naturally fits the Multiple Instance Learning (MIL) framework: every training image is known to have (or not) at least one pixel corresponding to the image class label, and the segmentation task can be rewritten as inferring the pixels belonging to the class of the object (given one image, and its object class).  We propose a Convolutional Neural Network-based model, which is constrained during training to put more weight on pixels which are important for classifying the image. We show that at test time, the model has learned to discriminate the right pixels well enough, such that it performs very well on an existing segmentation benchmark, by adding only few smoothing priors. Our system is trained using a subset of the Imagenet dataset and the segmentation experiments are performed on the challenging Pascal VOC dataset (with no fine-tuning of the model on Pascal VOC). Our model beats the state of the art results in weakly supervised object segmentation task by a large margin. We also compare the performance of our model with state of the art fully-supervised segmentation approaches.
Efficient and Accurate Approximations of Nonlinear Convolutional Networks	Xiangyu Zhang, Jianhua Zou, Xiang Ming, Kaiming He, Jian Sun; Proceedings of the IEEE Conference on Computer Vision and Pattern Recognition (CVPR), 2015, pp. 1984-1992	https://openaccess.thecvf.com/content_cvpr_2015/papers/Zhang_Efficient_and_Accurate_2015_CVPR_paper.pdf	This paper aims to accelerate the test-time computation of deep convolutional neural networks (CNNs). Unlike existing methods that are designed for approximating linear filters or linear responses, our method takes the nonlinear units into account. We minimize the reconstruction error of the nonlinear responses, subject to a low-rank constraint which helps to reduce the complexity of filters. We develop an effective solution to this constrained nonlinear optimization problem. An algorithm is also presented for reducing the accumulated error when multiple layers are approximated. A whole-model speedup ratio of 4x is demonstrated   on a large network trained for ImageNet, while the top-5 error rate is only increased by 0.9%. Our accelerated model has a comparably fast speed as the "AlexNet", but is 4.7% more accurate.
Saliency Propagation From Simple to Difficult	Chen Gong, Dacheng Tao, Wei Liu, Stephen J. Maybank, Meng Fang, Keren Fu, Jie Yang; Proceedings of the IEEE Conference on Computer Vision and Pattern Recognition (CVPR), 2015, pp. 2531-2539	https://openaccess.thecvf.com/content_cvpr_2015/papers/Gong_Saliency_Propagation_From_2015_CVPR_paper.pdf	Saliency propagation has been widely adopted for identifying the most attractive object in an image. The propagation sequence generated by existing saliency detection methods is governed by the spatial relationships of image regions, i.e., the saliency value is transmitted between two adjacent regions. However, for the inhomogeneous difficult adjacent regions, such a sequence may incur wrong propagations. In this paper, we attempt to manipulate the propagation sequence for optimizing the propagation quality. Intuitively, we postpone the propagations to difficult regions and meanwhile advance the propagations to less ambiguous simple regions. Inspired by the theoretical results in educational psychology, a novel propagation algorithm employing the teaching-to-learn and learning-to-teach strategies is proposed to explicitly improve the propagation quality. In the teaching-to-learn step, a teacher is designed to arrange the regions from simple to difficult and then assign the simplest regions to the learner. In the learning-to-teach step, the learner delivers its learning confidence to the teacher to assist the teacher to choose the subsequent simple regions. Due to the interactions between the teacher and learner, the uncertainty of original difficult regions is gradually reduced, yielding manifest salient objects with optimized background suppression. Extensive experimental results on benchmark saliency datasets demonstrate the superiority of the proposed algorithm over twelve representative saliency detectors.
Practical Robust Two-View Translation Estimation	Johan Fredriksson, Viktor Larsson, Carl Olsson; Proceedings of the IEEE Conference on Computer Vision and Pattern Recognition (CVPR), 2015, pp. 2684-2690	https://openaccess.thecvf.com/content_cvpr_2015/papers/Fredriksson_Practical_Robust_Two-View_2015_CVPR_paper.pdf	Outliers pose a problem in all real structure from motion systems. Due to the use of automatic matching methods one has to expect that a (sometimes very large) portion of the detected correspondences can be incorrect. In this paper we propose a method that estimates the relative translation between two cameras and simultaneously maximizes the number of inlier correspondences. Traditionally, outlier removal tasks have been addressed using RANSAC approaches. However, these are random in nature and offer no guarantees of finding a good solution. If the amount of mismatches is large, the approach becomes costly because of the need to evaluate a large number of random samples. In contrast, our approach is based on the branch and bound methodology which guarantees that an optimal solution will be found. While most optimal methods trade speed for optimality, the proposed algorithm has competitive running times on problem sizes well beyond what is common in practice. Experiments on both real and synthetic data show that the method outperforms state-of-the-art alternatives, including RANSAC, in terms of solution quality. In addition, the approach is shown to be faster than RANSAC in settings with a large amount of outliers.
A MRF Shape Prior for Facade Parsing With Occlusions	Mateusz Kozinski, Raghudeep Gadde, Sergey Zagoruyko, Guillaume Obozinski, Renaud Marlet; Proceedings of the IEEE Conference on Computer Vision and Pattern Recognition (CVPR), 2015, pp. 2820-2828	https://openaccess.thecvf.com/content_cvpr_2015/papers/Kozinski_A_MRF_Shape_2015_CVPR_paper.pdf	We present a new shape prior formalism for segmentation of rectified facade images. It combines the simplicity of split grammars with unprecedented expressive power: the capability of encoding simultaneous alignment in two dimensions, facade occlusions and irregular boundaries between facade elements. Our method simultaneously segments the visible and occluding objects and recovers the structure of the occluded facade. We formulate the task of finding the most likely image segmentation conforming to a prior of the proposed form as a MAP-MRF problem over the standard 4-connected pixel grid with hard constraints on the classes of neighboring pixels, and propose an efficient optimization algorithm for solving it. We demonstrate state of the art results on a number of facade segmentation datasets.
Learning Lightness From Human Judgement on Relative Reflectance	Takuya Narihira, Michael Maire, Stella X. Yu; Proceedings of the IEEE Conference on Computer Vision and Pattern Recognition (CVPR), 2015, pp. 2965-2973	https://openaccess.thecvf.com/content_cvpr_2015/papers/Narihira_Learning_Lightness_From_2015_CVPR_paper.pdf	We develop a new approach to inferring lightness, the perceived reflectance of surfaces, from a single image.  Classic methods view this problem from the perspective of intrinsic image decomposition, where an image is separated into reflectance and shading components.  Rather than reason about reflectance and shading together, we learn to directly predict lightness differences between pixels.  Large-scale training from human judgement data on relative reflectance, and patch representations built using deep networks, provide the foundation for our model.  Benchmarked on the Intrinsic Images in the Wild dataset, our local lightness model achieves on-par performance with the state-of-the-art global lightness model, which incorporates multiple shading/reflectance priors and simultaneous reasoning between pairs of pixels in a dense conditional random field formulation.
Video Co-Summarization: Video Summarization by Visual Co-Occurrence	Wen-Sheng Chu, Yale Song, Alejandro Jaimes; Proceedings of the IEEE Conference on Computer Vision and Pattern Recognition (CVPR), 2015, pp. 3584-3592	https://openaccess.thecvf.com/content_cvpr_2015/papers/Chu_Video_Co-Summarization_Video_2015_CVPR_paper.pdf	We present video co-summarization, a novel perspective to video summarization that exploits visual co-occurrence across multiple videos. Motivated by the observation that important visual concepts tend to appear repeatedly across videos of the same topic, we propose to summarize a video by finding shots that co-occur most frequently across videos collected using a topic keyword. The main technical challenge is dealing with the sparsity of co-occurring patterns, out of hundreds to possibly thousands of irrelevant shots in videos being considered. To deal with this challenge, we developed a Maximal Biclique Finding (MBF) algorithm that is optimized to find sparsely co-occurring patterns, discarding less co-occurring patterns even if they are dominant in one video. Our algorithm is parallelizable with closed-form updates, thus can easily scale up to handle a large number of videos simultaneously. We demonstrate the effectiveness of our approach on motion capture and self-compiled YouTube datasets. Our results suggest that summaries generated by visual co-occurrence tend to match more closely with human generated summaries, when compared to several popular unsupervised techniques.
DeepContour: A Deep Convolutional Feature Learned by Positive-Sharing Loss for Contour Detection	Wei Shen, Xinggang Wang, Yan Wang, Xiang Bai, Zhijiang Zhang; Proceedings of the IEEE Conference on Computer Vision and Pattern Recognition (CVPR), 2015, pp. 3982-3991	https://openaccess.thecvf.com/content_cvpr_2015/papers/Shen_DeepContour_A_Deep_2015_CVPR_paper.pdf	Contour detection serves as the basis of a variety of computer vision tasks such as image segmentation and object recognition. The mainstream works to address this problem focus on designing engineered gradient features. In this work, we show that contour detection accuracy can be improved by instead making the use of the deep features learned from convolutional neural networks (CNNs). While rather than using the networks as a blackbox feature extractor, we customize the training strategy by partitioning contour (positive) data into subclasses and fitting each subclass by different model parameters. A new loss function, named positive-sharing loss, in which each subclass shares the loss for the whole positive class, is proposed to learn the parameters. Compared to the sofmax loss function, the proposed one, introduces an extra regularizer to emphasizes the losses for the positive and negative classes, which facilitates to explore more discriminative features. Our experimental results demonstrate that learned deep features can achieve top performance on Berkeley Segmentation Dataset and Benchmark (BSDS500) and obtain competitive cross dataset generalization result on the NYUD dataset.
Reflection Removal for In-Vehicle Black Box Videos	Christian Simon, In Kyu Park; Proceedings of the IEEE Conference on Computer Vision and Pattern Recognition (CVPR), 2015, pp. 4231-4239	https://openaccess.thecvf.com/content_cvpr_2015/papers/Simon_Reflection_Removal_for_2015_CVPR_paper.pdf	In-vehicle black box camera becomes an popular equipment in many countries for security monitoring and event capturing. The readability of video contents is the most important capability, which is, however, often degraded due to the reflection on the windscreen. In this paper, we propose a novel method to remove the reflection on the windscreen in the in-vehicle black box videos. The main idea is to exploit spatio-temporal coherence of the reflection which shows that a vehicle moves forward while the reflection layer of internal object remains static. The average image prior is introduced by imposing a heavy-tail distribution with higher peak. The two layered scene is the base of the separation model. In order to remove the reflection, a cost non-convex function is developed based on this property and optimized. Experimental results demonstrate that the proposed approach successfully separates the layers in real black box videos.
Weakly Supervised Localization of Novel Objects Using Appearance Transfer	Mrigank Rochan, Yang Wang; Proceedings of the IEEE Conference on Computer Vision and Pattern Recognition (CVPR), 2015, pp. 4315-4324	https://openaccess.thecvf.com/content_cvpr_2015/papers/Rochan_Weakly_Supervised_Localization_2015_CVPR_paper.pdf	We consider the problem of localizing unseen objects in weakly labeled image collections. Given a set of images annotated at the image level, our goal is to localize the object in each image. The novelty of our proposed work is in addition to building object appearance model from the weakly labeled data, we also make use of existing detectors for some other object classes (which we call ``familiar objects''). We propose a method for transferring the appearance models of the familiar objects to the unseen object. Our experimental results on both image and video datasets demonstrate the effectiveness of our approach.
