OSTeC: One-Shot Texture Completion	Baris Gecer, Jiankang Deng, Stefanos Zafeiriou; Proceedings of the IEEE/CVF Conference on Computer Vision and Pattern Recognition (CVPR), 2021, pp. 7628-7638	https://openaccess.thecvf.com/content/CVPR2021/papers/Gecer_OSTeC_One-Shot_Texture_Completion_CVPR_2021_paper.pdf	The last few years have witnessed the great success of non-linear generative models in synthesizing high-quality photorealistic face images. Many recent 3D facial texture reconstruction and pose manipulation from a single image approaches still rely on large and clean face datasets to train image-to-image Generative Adversarial Networks (GANs). Yet the collection of such a large scale high-resolution 3D texture dataset is still very costly and difficult to maintain age/ethnicity balance. Moreover, regression-based approaches suffer from generalization to the in-the-wild conditions and are unable to fine-tune to a target-image. In this work, we propose an unsupervised approach for one-shot 3D facial texture completion that does not require large-scale texture datasets, but rather harnesses the knowledge stored in 2D face generators. The proposed approach rotates an input image in 3D and fill-in the unseen regions by reconstructing the rotated image in a 2D face generator, based on the visible parts. Finally, we stitch the most visible textures at different angles in the UV image-plane. Further, we frontalize the target image by projecting the completed texture into the generator. The qualitative and quantitative experiments demonstrate that the completed UV textures and frontalized images are of high quality, resembles the original identity, can be used to train a texture GAN model for 3DMM fitting and improve pose-invariant face recognition.
PML: Progressive Margin Loss for Long-Tailed Age Classification	Zongyong Deng, Hao Liu, Yaoxing Wang, Chenyang Wang, Zekuan Yu, Xuehong Sun; Proceedings of the IEEE/CVF Conference on Computer Vision and Pattern Recognition (CVPR), 2021, pp. 10503-10512	https://openaccess.thecvf.com/content/CVPR2021/papers/Deng_PML_Progressive_Margin_Loss_for_Long-Tailed_Age_Classification_CVPR_2021_paper.pdf	In this paper, we propose a progressive margin loss (PML) approach for unconstrained facial age classification. Conventional methods make strong assumption on that each class owns adequate instances to outline its data distribution, likely leading to bias prediction where the training samples are sparse across age classes. Instead, our PML aims to adaptively refine the age label pattern by enforcing a couple of margins, which fully takes in the in-between discrepancy of the intra-class variance, inter-class variance and class-center. Our PML typically incorporates with the ordinal margin and the variational margin, simultaneously plugging in the globally-tuned deep neural network paradigm. More specifically, the ordinal margin learns to exploit the correlated relationship of the real-world age labels. Accordingly, the variational margin is leveraged to minimize the influence of head classes that misleads the prediction of tailed samples. Moreover, our optimization carefully seeks a series of indicator curricula to achieve robust and efficient model training. Extensive experimental results on three face aging datasets demonstrate that our PML achieves compelling performance compared to state of the arts. Code will be made publicly.
img2pose: Face Alignment and Detection via 6DoF, Face Pose Estimation	Vitor Albiero, Xingyu Chen, Xi Yin, Guan Pang, Tal Hassner; Proceedings of the IEEE/CVF Conference on Computer Vision and Pattern Recognition (CVPR), 2021, pp. 7617-7627	https://openaccess.thecvf.com/content/CVPR2021/papers/Albiero_img2pose_Face_Alignment_and_Detection_via_6DoF_Face_Pose_Estimation_CVPR_2021_paper.pdf	We propose real-time, six degrees of freedom (6DoF), 3D face pose estimation without face detection or landmark localization. We observe that estimating the 6DoF rigid transformation of a face is a simpler problem than facial landmark detection, often used for 3D face alignment. In addition, 6DoF offers more information than face bounding box labels. We leverage these observations to make multiple contributions: (a) We describe an easily trained, efficient, Faster R-CNN-based model which regresses 6DoF pose for all faces in the photo, without preliminary face detection. (b) We explain how pose is converted and kept consistent between the input photo and arbitrary crops created while training and evaluating our model. (c) Finally, we show how face poses can replace detection bounding box training labels. Tests on AFLW2000-3D and BIWI show that our method runs at real-time and outperforms state of the art (SotA) face pose estimators. Remarkably, our method also surpasses SotA models of comparable complexity on the WIDER FACE detection benchmark, despite not been optimized on bounding box labels.
MagDR: Mask-Guided Detection and Reconstruction for Defending Deepfakes	Zhikai Chen, Lingxi Xie, Shanmin Pang, Yong He, Bo Zhang; Proceedings of the IEEE/CVF Conference on Computer Vision and Pattern Recognition (CVPR), 2021, pp. 9014-9023	https://openaccess.thecvf.com/content/CVPR2021/papers/Chen_MagDR_Mask-Guided_Detection_and_Reconstruction_for_Defending_Deepfakes_CVPR_2021_paper.pdf	Deepfakes raised serious concerns on the authenticity of visual contents. Prior works revealed the possibility to disrupt deepfakes by adding adversarial perturbations to the source data, but we argue that the threat has not been eliminated yet. This paper presents MagDR, a mask-guided detection and reconstruction pipeline for defending deepfakes from adversarial attacks. MagDR starts with a detection module that defines a few criteria to judge the abnormality of the output of deepfakes, and then uses it to guide an learnable reconstruction procedure. Adaptive masks are extracted to capture the change in local facial regions. In experiments, MagDR defends three main tasks of deepfakes, and the learned reconstruction pipeline transfers across input data, showing promising performance in defending both black-box and white-box attacks.
When Age-Invariant Face Recognition Meets Face Age Synthesis: A Multi-Task Learning Framework	Zhizhong Huang, Junping Zhang, Hongming Shan; Proceedings of the IEEE/CVF Conference on Computer Vision and Pattern Recognition (CVPR), 2021, pp. 7282-7291	https://openaccess.thecvf.com/content/CVPR2021/papers/Huang_When_Age-Invariant_Face_Recognition_Meets_Face_Age_Synthesis_A_Multi-Task_CVPR_2021_paper.pdf	To minimize the effects of age variation in face recognition, previous work either extracts identity-related discriminative features by minimizing the correlation between identity- and age-related features, called age-invariant face recognition (AIFR), or removes age variation by transforming the faces of different age groups into the same age group, called face age synthesis (FAS); however, the former lacks visual results for model interpretation while the latter suffers from artifacts compromising downstream recognition. Therefore, this paper proposes a unified, multi-task framework to jointly handle these two tasks, termed MTLFace, which can learn age-invariant identity-related representation while achieving pleasing face synthesis. Specifically, we first decompose the mixed face features into two uncorrelated components---identity- and age-related features---through an attention mechanism, and then decorrelate these two components using multi-task training and continuous domain adaption. In contrast to the conventional one-hot encoding that achieves group-level FAS, we propose a novel identity conditional module to achieve identity-level FAS, with a weight-sharing strategy to improve the age smoothness of synthesized faces. In addition, we collect and release a large cross-age face dataset with age and gender annotations to advance AIFR and FAS. Extensive experiments on five benchmark cross-age datasets demonstrate the superior performance of our proposed MTLFace over state-of-the-art methods for AIFR and FAS. We further validate MTLFace on two popular general face recognition datasets, showing competitive performance for face recognition in the wild. The source code and dataset are available at https://github.com/Hzzone/MTLFace.
SDD-FIQA: Unsupervised Face Image Quality Assessment With Similarity Distribution Distance	Fu-Zhao Ou, Xingyu Chen, Ruixin Zhang, Yuge Huang, Shaoxin Li, Jilin Li, Yong Li, Liujuan Cao, Yuan-Gen Wang; Proceedings of the IEEE/CVF Conference on Computer Vision and Pattern Recognition (CVPR), 2021, pp. 7670-7679	https://openaccess.thecvf.com/content/CVPR2021/papers/Ou_SDD-FIQA_Unsupervised_Face_Image_Quality_Assessment_With_Similarity_Distribution_Distance_CVPR_2021_paper.pdf	In recent years, Face Image Quality Assessment (FIQA) has become an indispensable part of the face recognition system to guarantee the stability and reliability of recognition performance in an unconstrained scenario. For this purpose, the FIQA method should consider both the intrinsic property and the recognizability of the face image. Most previous works aim to estimate the sample-wise embedding uncertainty or pair-wise similarity as the quality score, which only considers the partial information from the intra-class. However, these methods ignore the valuable information from the inter-class, which is for estimating the recognizability of face image. In this work, we argue that a high-quality face image should be similar to its intra-class samples and dissimilar to its inter-class samples. Thus, we propose a novel unsupervised FIQA method that incorporates Similarity Distribution Distance for Face Image Quality Assessment (SDD-FIQA). Our method generates quality pseudo-labels by calculating the Wasserstein Distance (WD) between the intra-class and inter-class similarity distributions. With these quality pseudo-labels, we are capable of training a regression network for quality prediction. Extensive experiments on benchmark datasets demonstrate that the proposed SDD-FIQA surpasses the state-of-the-arts by an impressive margin. Meanwhile, our method shows good generalization across different recognition systems.
Clusformer: A Transformer Based Clustering Approach to Unsupervised Large-Scale Face and Visual Landmark Recognition	Xuan-Bac Nguyen, Duc Toan Bui, Chi Nhan Duong, Tien D. Bui, Khoa Luu; Proceedings of the IEEE/CVF Conference on Computer Vision and Pattern Recognition (CVPR), 2021, pp. 10847-10856	https://openaccess.thecvf.com/content/CVPR2021/papers/Nguyen_Clusformer_A_Transformer_Based_Clustering_Approach_to_Unsupervised_Large-Scale_Face_CVPR_2021_paper.pdf	The research in automatic unsupervised visual clustering has received considerable attention over the last couple years. It aims at explaining distributions of unlabeled visual images by clustering them via a parameterized model of appearance. Graph Convolutional Neural Networks (GCN) have recently been one of the most popular clustering methods. However, it has reached some limitations. Firstly, it is quite sensitive to hard or noisy samples. Secondly, it is hard to investigate with various deep network models due to its computational training time. Finally, it is hard to design an end-to-end training model between the deep feature extraction and GCN clustering modeling. This work therefore presents the Clusformer, a simple but new perspective of Transformer based approach, to automatic visual clustering via its unsupervised attention mechanism. The proposed method is able to robustly deal with noisy or hard samples. It is also flexible and effective to collaborate with different deep network models with various model sizes in an end-to-end framework. The proposed method is evaluated on two popular large-scale visual databases, i.e. Google Landmark and MS-Celeb-1M face database, and outperforms prior unsupervised clustering methods. Code will be available at https://github.com/VinAIResearch/Clusformer
Dynamic Neural Radiance Fields for Monocular 4D Facial Avatar Reconstruction	Guy Gafni, Justus Thies, Michael Zollhofer, Matthias Niessner; Proceedings of the IEEE/CVF Conference on Computer Vision and Pattern Recognition (CVPR), 2021, pp. 8649-8658	https://openaccess.thecvf.com/content/CVPR2021/papers/Gafni_Dynamic_Neural_Radiance_Fields_for_Monocular_4D_Facial_Avatar_Reconstruction_CVPR_2021_paper.pdf	We present dynamic neural radiance fields for modeling the appearance and dynamics of a human face. Digitally modeling and reconstructing a talking human is a key building-block for a variety of applications. Especially, for telepresence applications in AR or VR, a faithful reproduction of the appearance including novel viewpoint or head-poses is required. In contrast to state-of-the-art approaches that model the geometry and material properties explicitly, or are purely image-based, we introduce an implicit representation of the head based on scene representation networks. To handle the dynamics of the face, we combine our scene representation network with a low-dimensional morphable model which provides explicit control over pose and expressions. We use volumetric rendering to generate images from this hybrid representation and demonstrate that such a dynamic neural scene representation can be learned from monocular input data only, without the need of a specialized capture setup. In our experiments, we show that this learned volumetric representation allows for photorealistic image generation that surpasses the quality of state-of-the-art video-based reenactment methods.
Towards Real-World Blind Face Restoration With Generative Facial Prior	Xintao Wang, Yu Li, Honglun Zhang, Ying Shan; Proceedings of the IEEE/CVF Conference on Computer Vision and Pattern Recognition (CVPR), 2021, pp. 9168-9178	https://openaccess.thecvf.com/content/CVPR2021/papers/Wang_Towards_Real-World_Blind_Face_Restoration_With_Generative_Facial_Prior_CVPR_2021_paper.pdf	Blind face restoration usually relies on facial priors, such as facial geometry prior or reference prior, to restore realistic and faithful details. However, very low-quality inputs cannot offer accurate geometric prior while high-quality references are inaccessible, limiting the applicability in real-world scenarios. In this work, we propose GFP-GAN that leverages rich and diverse priors encapsulated in a pretrained face GAN for blind face restoration. This Generative Facial Prior (GFP) is incorporated into the face restoration process via spatial feature transform layers, which allow our method to achieve a good balance of realness and fidelity. Thanks to the powerful generative facial prior and delicate designs, our GFP-GAN could jointly restore facial details and enhance colors with just a single forward pass, while GAN inversion methods require image-specific optimization at inference. Extensive experiments show that our method achieves superior performance to prior art on both synthetic and real-world datasets.
3DCaricShop: A Dataset and a Baseline Method for Single-View 3D Caricature Face Reconstruction	Yuda Qiu, Xiaojie Xu, Lingteng Qiu, Yan Pan, Yushuang Wu, Weikai Chen, Xiaoguang Han; Proceedings of the IEEE/CVF Conference on Computer Vision and Pattern Recognition (CVPR), 2021, pp. 10236-10245	https://openaccess.thecvf.com/content/CVPR2021/papers/Qiu_3DCaricShop_A_Dataset_and_a_Baseline_Method_for_Single-View_3D_CVPR_2021_paper.pdf	Caricature is an artistic representation that deliberately exaggerates the distinctive features of a human face to convey humor or sarcasm. However, reconstructing a 3D caricature from a 2D caricature image remains a challenging task, mostly due to the lack of data. We propose to fill this gap by introducing 3DCaricShop, the first large-scale 3D caricature dataset that contains 2000 high-quality diversified 3D caricatures manually crafted by professional artists. 3DCaricShop also provides rich annotations including a paired 2D caricature image, camera parameters, and 3D facial landmarks. To demonstrate the advantage of 3DCaricShop, we present a novel baseline approach for single-view 3D caricature reconstruction. To ensure a faithful reconstruction with plausible face deformations, we propose to connect the good ends of the detail-rich implicit functions and the parametric mesh representations. In particular, we first register a template mesh to the output of the implicit generator and iteratively project the registration result onto a pre-trained PCA space to resolve artifacts and self-intersections. To deal with the large deformation during non-rigid registration, we propose a novel view-collaborative graph convolution network (VC-GCN) to extract key points from the implicit mesh for accurate alignment. Our method is able to generate high-fidelity 3D caricature in a pre-defined mesh topology that is animation-ready. Extensive experiments have been conducted on 3DCaricShop to verify the significance of the database and the effectiveness of the proposed method. We will release 3DCaricShop upon publication.
Feature Decomposition and Reconstruction Learning for Effective Facial Expression Recognition	Delian Ruan, Yan Yan, Shenqi Lai, Zhenhua Chai, Chunhua Shen, Hanzi Wang; Proceedings of the IEEE/CVF Conference on Computer Vision and Pattern Recognition (CVPR), 2021, pp. 7660-7669	https://openaccess.thecvf.com/content/CVPR2021/papers/Ruan_Feature_Decomposition_and_Reconstruction_Learning_for_Effective_Facial_Expression_Recognition_CVPR_2021_paper.pdf	In this paper, we propose a novel Feature Decomposition and Reconstruction Learning (FDRL) method for effective facial expression recognition. We view the expression information as the combination of the shared information (expression similarities) across different expressions and the unique information (expression-specific variations) for each expression. More specifically, FDRL mainly consists of two crucial networks: a Feature Decomposition Network (FDN) and a Feature Reconstruction Network (FRN). In particular, FDN first decomposes the basic features extracted from a backbone network into a set of facial action-aware latent features to model expression similarities. Then, FRN captures the intra-feature and inter-feature relationships for latent features to characterize expression-specific variations, and reconstructs the expression feature. To this end, two modules including an intra-feature relation modeling module and an inter-feature relation modeling module are developed in FRN. Experimental results on both the in-the-lab databases (including CK+, MMI, and Oulu-CASIA) and the in-the-wild databases (including RAF-DB and SFEW) show that the proposed FDRL method consistently achieves higher recognition accuracy than several state-of-the-art methods. This clearly highlights the benefit of feature decomposition and reconstruction for classifying expressions.
WebFace260M: A Benchmark Unveiling the Power of Million-Scale Deep Face Recognition	Zheng Zhu, Guan Huang, Jiankang Deng, Yun Ye, Junjie Huang, Xinze Chen, Jiagang Zhu, Tian Yang, Jiwen Lu, Dalong Du, Jie Zhou; Proceedings of the IEEE/CVF Conference on Computer Vision and Pattern Recognition (CVPR), 2021, pp. 10492-10502	https://openaccess.thecvf.com/content/CVPR2021/papers/Zhu_WebFace260M_A_Benchmark_Unveiling_the_Power_of_Million-Scale_Deep_Face_CVPR_2021_paper.pdf	In this paper, we contribute a new million-scale face benchmark containing noisy 4M identities/260M faces (WebFace260M) and cleaned 2M identities/42M faces (WebFace42M) training data, as well as an elaborately designed time-constrained evaluation protocol. Firstly, we collect 4M name list and download 260M faces from the Internet. Then, a Cleaning Automatically utilizing Self-Training (CAST) pipeline is devised to purify the tremendous WebFace260M, which is efficient and scalable. To the best of our knowledge, the cleaned WebFace42M is the largest public face recognition training set and we expect to close the data gap between academia and industry. Referring to practical scenarios, Face Recognition Under Inference Time conStraint (FRUITS) protocol and a test set are constructed to comprehensively evaluate face matchers. Equipped with this benchmark, we delve into million-scale face recognition problems. A distributed framework is developed to train face recognition models efficiently without tampering with the performance. Empowered by WebFace42M, we reduce relative 40% failure rate on the challenging IJB-C set, and rank the 3rd among 430 entries on NIST-FRVT. Even 10% data (WebFace4M) shows superior performance compared with public training set. Furthermore, comprehensive baselines are established on our rich-attribute test set under FRUITS-100ms/500ms/1000ms protocol, including MobileNet, EfficientNet, AttentionNet, ResNet, SENet, ResNeXt and RegNet families. Benchmark website is https://www.face-benchmark.org.
Facial Action Unit Detection With Transformers	Geethu Miriam Jacob, Bjorn Stenger; Proceedings of the IEEE/CVF Conference on Computer Vision and Pattern Recognition (CVPR), 2021, pp. 7680-7689	https://openaccess.thecvf.com/content/CVPR2021/papers/Jacob_Facial_Action_Unit_Detection_With_Transformers_CVPR_2021_paper.pdf	The Facial Action Coding System is a taxonomy for fine-grained facial expression analysis. This paper proposes a method for detecting Facial Action Units (FAU), which define particular face muscle activity, from an input image. FAU detection is formulated as a multi-task learning problem, where image features and attention maps are input to a branch for each action unit to extract discriminative feature embeddings, using a new loss function, the Center Contrastive (CC) loss. We employ a new FAU correlation network, based on a transformer encoder architecture, to capture the relationships between different action units for the wide range of expressions in the training data. The resulting features are shown to yield high classification performance. We validate our design choices, including the use of CC loss and Tversky loss functions, in ablative experiments. We show that the proposed method outperforms state-of-theart techniques on two public datasets, BP4D and DISFA, with an absolute improvement of the F1-score of over 2% on each.
VirFace: Enhancing Face Recognition via Unlabeled Shallow Data	Wenyu Li, Tianchu Guo, Pengyu Li, Binghui Chen, Biao Wang, Wangmeng Zuo, Lei Zhang; Proceedings of the IEEE/CVF Conference on Computer Vision and Pattern Recognition (CVPR), 2021, pp. 14729-14738	https://openaccess.thecvf.com/content/CVPR2021/papers/Li_VirFace_Enhancing_Face_Recognition_via_Unlabeled_Shallow_Data_CVPR_2021_paper.pdf	Recently, exploiting the effect of the unlabeled data for face recognition attracts increasing attention. However, there are still few works considering the situation that the unlabeled data is shallow which widely exists in real-world scenarios. The existing semi-supervised face recognition methods which focus on generating pseudo labels or minimizing softmax classification probabilities of the unlabeled data don't work very well on the unlabeled shallow data. Thus, it is still a challenge on how to effectively utilize the unlabeled shallow face data for improving the performance of face recognition. In this paper, we propose a novel face recognition method, named VirFace, to effectively apply the unlabeled shallow data for face recognition. VirFace consists of VirClass and VirInstance. Specifically, VirClass enlarges the inter-class distance by injecting the unlabeled data as new identities. Furthermore, VirInstance produces virtual instances sampled from the learned distribution of each identity to further enlarge the inter-class distance. To the best of our knowledge, we are the first working on tackling the unlabeled shallow face data. Extensive experiments have been conducted on both the small- and large-scale datasets, e.g. LFW and IJB-C, etc, showing the superiority of the proposed method.
MagFace: A Universal Representation for Face Recognition and Quality Assessment	Qiang Meng, Shichao Zhao, Zhida Huang, Feng Zhou; Proceedings of the IEEE/CVF Conference on Computer Vision and Pattern Recognition (CVPR), 2021, pp. 14225-14234	https://openaccess.thecvf.com/content/CVPR2021/papers/Meng_MagFace_A_Universal_Representation_for_Face_Recognition_and_Quality_Assessment_CVPR_2021_paper.pdf	The performance of face recognition system degrades when the variability of the acquired faces increases. Prior work alleviates this issue by either monitoring the face quality in pre-processing or predicting the data uncertainty along with the face feature. This paper proposes MagFace, a category of losses that learn a universal feature embedding whose magnitude before normalization can measure with the quality of the given face. Under the new loss, it can be proven that the magnitude of the feature embedding monotonically increases if the subject is more likely to be recognized. In addition, MagFace introduces an adaptive mechanism to learn a well-structured within-class feature distributions by pushing easy samples to class centers while pushing hard samples away. This prevents models from overfitting on noisy low-quality samples and improves face recognition in the wild. Extensive experiments conducted on face recognition, quality assessments as well as clustering have demonstrated the effectiveness of MagFace over state-of-the-arts. The code is available at https://github.com/IrvingMeng/MagFace.
