Walk and Learn: Facial Attribute Representation Learning From Egocentric Video and Contextual Data	Jing Wang, Yu Cheng, Rogerio Schmidt Feris; Proceedings of the IEEE Conference on Computer Vision and Pattern Recognition (CVPR), 2016, pp. 2295-2304	https://openaccess.thecvf.com/content_cvpr_2016/papers/Wang_Walk_and_Learn_CVPR_2016_paper.pdf	The way people look in terms of facial attributes (ethnicity, hair color, facial hair, etc.) and the clothes or accessories they wear (sunglasses, hat, hoodies, etc.) is highly dependent on geo-location and weather condition, respectively. This work explores, for the first time, the use of this contextual information, as people with wearable cameras walk across different neighborhoods of a city, in order to learn a rich feature representation for facial attribute classification, without the costly manual annotation required by previous methods. By tracking the faces of casual walkers on more than 40 hours of egocentric video, we are able to cover tens of thousands of different identities and automatically extract nearly 5 million pairs of images connected by or from different face tracks, along with their weather and location context, under pose and lighting variations. These image pairs are then fed into a deep network that preserves similarity of images connected by the same track, in order to capture identity-related attribute features, and optimizes for location and weather prediction to capture additional facial attribute features. Finally, the network is fine-tuned with manually annotated samples. We perform an extensive experimental analysis on wearable data and two standard benchmark datasets based on web images (LFWA and CelebA). Our method outperforms by a large margin a network trained from scratch. Moreover, even without using manually annotated identity labels for pre-training as in previous methods, our approach achieves results that are better than the state of the art.
Face2Face: Real-Time Face Capture and Reenactment of RGB Videos	Justus Thies, Michael Zollhofer, Marc Stamminger, Christian Theobalt, Matthias Niessner; Proceedings of the IEEE Conference on Computer Vision and Pattern Recognition (CVPR), 2016, pp. 2387-2395	https://openaccess.thecvf.com/content_cvpr_2016/papers/Thies_Face2Face_Real-Time_Face_CVPR_2016_paper.pdf	We present a novel approach for real-time facial reenactment of a monocular target video sequence (e.g., Youtube video). The source sequence is also a monocular video stream, captured live with a commodity webcam. Our goal is to animate the facial expressions of the target video by a source actor and re-render the manipulated output video in a photo-realistic fashion. To this end, we first address the under-constrained problem of facial identity recovery from monocular video by non-rigid model-based bundling. At run time, we track facial expressions of both source and target video using a dense photometric consistency measure. Reenactment is then achieved by fast and efficient deformation transfer between source and target. The mouth interior that best matches the re-targeted expression is retrieved from the target sequence and warped to produce an accurate fit. Finally, we convincingly re-render the synthesized target face on top of the corresponding video stream such that it seamlessly blends with the real-world illumination. We demonstrate our method in a live setup, where Youtube videos are reenacted in real time.
Constrained Joint Cascade Regression Framework for Simultaneous Facial Action Unit Recognition and Facial Landmark Detection	Yue Wu, Qiang Ji; Proceedings of the IEEE Conference on Computer Vision and Pattern Recognition (CVPR), 2016, pp. 3400-3408	https://openaccess.thecvf.com/content_cvpr_2016/papers/Wu_Constrained_Joint_Cascade_CVPR_2016_paper.pdf	Cascade regression framework has been shown to be effective for facial landmark detection. It starts from an initial face shape and gradually predicts the face shape update from the local appearance features to generate the facial landmark locations in the next iteration until convergence. In this paper, we improve upon the cascade regression framework and propose the Constrained Joint Cascade Regression Framework (CJCRF) for simultaneous facial action unit recognition and facial landmark detection, which are two related face analysis tasks, but are seldomly exploited together. In particular, we first learn the relationships among facial action units and face shapes as a constraint. Then, in the proposed constrained joint cascade regression framework, with the help from the constraint, we iteratively update the facial landmark locations and the action unit activation probabilities until convergence. Experimental results demonstrate that the intertwined relationships of facial action units and face shapes boost the performances of both facial action unit recognition and facial landmark detection. The experimental results also demonstrate the effectiveness of the proposed method comparing to the state-of-the-art works.
Automated 3D Face Reconstruction From Multiple Images Using Quality Measures	Marcel Piotraschke, Volker Blanz; Proceedings of the IEEE Conference on Computer Vision and Pattern Recognition (CVPR), 2016, pp. 3418-3427	https://openaccess.thecvf.com/content_cvpr_2016/papers/Piotraschke_Automated_3D_Face_CVPR_2016_paper.pdf	Automated 3D reconstruction of faces from images is challenging if the image material is difficult in terms of pose, lighting, occlusions and facial expressions, and if the initial 2D feature positions are inaccurate or unreliable. We propose a method that reconstructs individual 3D shapes from multiple single images of one person, judges their quality and then combines the best of all results. This is done separately for different regions of the face. The core element of this algorithm and the focus of our paper is a quality measure that judges a reconstruction without information about the true shape. We evaluate different quality measures, develop a method for combining results, and present a complete processing pipeline for automated reconstruction.
Adaptive 3D Face Reconstruction From Unconstrained Photo Collections	Joseph Roth, Yiying Tong, Xiaoming Liu; Proceedings of the IEEE Conference on Computer Vision and Pattern Recognition (CVPR), 2016, pp. 4197-4206	https://openaccess.thecvf.com/content_cvpr_2016/papers/Roth_Adaptive_3D_Face_CVPR_2016_paper.pdf	Given a collection of "in-the-wild" face images captured under a variety of unknown pose, expression, and illumination conditions, this paper presents a method for reconstructing a 3D face surface model of an individual along with albedo information. Motivated by the success of recent face reconstruction techniques on large photo collections, we extend prior work to adapt to low quality photo collections with fewer images. We achieve this by fitting a 3D Morphable Model to form a personalized template and developing a novel photometric stereo formulation, under a coarse-to-fine scheme. Superior experimental results are reported on synthetic and real-world photo collections.
CP-mtML: Coupled Projection Multi-Task Metric Learning for Large Scale Face Retrieval	Binod Bhattarai, Gaurav Sharma, Frederic Jurie; Proceedings of the IEEE Conference on Computer Vision and Pattern Recognition (CVPR), 2016, pp. 4226-4235	https://openaccess.thecvf.com/content_cvpr_2016/papers/Bhattarai_CP-mtML_Coupled_Projection_CVPR_2016_paper.pdf	We propose a novel Coupled Projection multi-task Met- ric Learning (CP-mtML) method for large scale face re- trieval. In contrast to previous works which were limited to low dimensional features and small datasets, the proposed method scales to large datasets with high dimensional face descriptors. It utilises pairwise (dis-)similarity constraints as supervision and hence does not require exhaustive class annotation for every training image. While, traditionally, multi-task learning methods have been validated on same dataset but different tasks, we work on the more chal- lenging setting with heterogeneous datasets and different tasks. We show empirical validation on multiple face im- age datasets of different facial traits, e.g. identity, age and expression. We use classic Local Binary Pattern (LBP) de- scriptors along with the recent Deep Convolutional Neural Network (CNN) features. The experiments clearly demon- strate the scalability and improved performance of the pro- posed method on the tasks of identity and age based face image retrieval compared to competitive existing methods, on the standard datasets and with the presence of a million distractor face images.
Logistic Boosting Regression for Label Distribution Learning	Chao Xing, Xin Geng, Hui Xue; Proceedings of the IEEE Conference on Computer Vision and Pattern Recognition (CVPR), 2016, pp. 4489-4497	https://openaccess.thecvf.com/content_cvpr_2016/papers/Xing_Logistic_Boosting_Regression_CVPR_2016_paper.pdf	Label Distribution Learning (LDL) is a general learning framework which includes both single label and multi-label learning as its special cases. One of the main assumptions made in traditional LDL algorithms is the derivation of the parametric model as the maximum entropy model. While it is a reasonable assumption without additional information, there is no particular evidence supporting it in the problem of LDL. Alternatively, using a general LDL model family to approximate this parametric model can avoid the potential influence of the specific model. In order to learn this general model family, this paper uses a method called Logistic Boosting Regression (LogitBoost) which can be seen as an additive weighted function regression from the statistical viewpoint. For each step, we can fit individual weighted regression function (base learner) to realize the optimization gradually. The base learners are chosen as weighted regression tree and vector tree, which constitute two algorithms named LDLogitBoost and AOSO-LDLogitBoost in this paper. Experiments on facial expression recognition, crowd opinion prediction on movies and apparent age estimation show that LDLogitBoost and AOSO-LDLogitBoost can achieve better performance than traditional LDL algorithms as well as other LogitBoost algorithms.
Multi-View Deep Network for Cross-View Classification	Meina Kan, Shiguang Shan, Xilin Chen; Proceedings of the IEEE Conference on Computer Vision and Pattern Recognition (CVPR), 2016, pp. 4847-4855	https://openaccess.thecvf.com/content_cvpr_2016/papers/Kan_Multi-View_Deep_Network_CVPR_2016_paper.pdf	Cross-view recognition that intends to classify samples between different views is an important problem in computer vision. The large discrepancy between different even heterogenous views make this problem quite challenging. To eliminate the complex (maybe even highly nonlinear) view discrepancy for favorable cross-view recognition, we propose a multi-view deep network (MvDN), which seeks for a non-linear discriminant and view-invariant representation shared between multiple views. Specifically, our proposed MvDN network consists of two sub-networks, view-specific sub-network attempting to remove view-specific variations and the following common sub-network attempting to obtain common representation shared by all views. As the objective of MvDN network, the Fisher loss, i.e. the Rayleigh quotient objective, is calculated from the samples of all views so as to guide the learning of the whole network. As a result, the representation from the topmost layers of the MvDN network is robust to view discrepancy, and also discriminative. The experiments of face recognition across pose and face recognition across feature type on three datasets with 13 and 2 views respectively demonstrate the superiority of the proposed method, especially compared to the typical linear ones.
Pose-Aware Face Recognition in the Wild	Iacopo Masi, Stephen Rawls, Gerard Medioni, Prem Natarajan; Proceedings of the IEEE Conference on Computer Vision and Pattern Recognition (CVPR), 2016, pp. 4838-4846	https://openaccess.thecvf.com/content_cvpr_2016/papers/Masi_Pose-Aware_Face_Recognition_CVPR_2016_paper.pdf	We propose a method to push the frontiers of unconstrained face recognition in the wild, focusing on the problem of extreme pose variations. As opposed to current techniques which either expect a single model to learn pose invariance through massive amounts of training data, or which normalize images to a single frontal pose, our method explicitly tackles pose variation by using multiple pose-specific models and rendered face images.  We leverage deep Convolutional Neural Networks (CNNs) to learn discriminative representations we call Pose-Aware Models (PAMs) using 500K images from the CASIA WebFace dataset. We present a comparative evaluation on the new IARPA Janus Benchmark A (IJB-A) and PIPA datasets. On these datasets PAMs achieve remarkably better performance than commercial products and surprisingly also outperform methods that are specifically fine-tuned on the target dataset.
Sparsifying Neural Network Connections for Face Recognition	Yi Sun, Xiaogang Wang, Xiaoou Tang; Proceedings of the IEEE Conference on Computer Vision and Pattern Recognition (CVPR), 2016, pp. 4856-4864	https://openaccess.thecvf.com/content_cvpr_2016/papers/Sun_Sparsifying_Neural_Network_CVPR_2016_paper.pdf	This paper proposes to learn high-performance deep ConvNets with sparse neural connections, referred to as sparse ConvNets, for face recognition. The sparse ConvNets are learned in an iterative way, each time one additional layer is sparsified and the entire model is re-trained given the initial weights learned in previous iterations. One important finding is that directly training the sparse ConvNet from scratch failed to find good solutions for face recognition, while using a previously learned denser model to properly initialize a sparser model is critical to continue learning effective features for face recognition. This paper also proposes a new neural correlation-based weight selection criterion and empirically verifies its effectiveness in selecting informative connections from previously learned models in each iteration. When taking a moderately sparse structure 26%-76% of weights in the dense model), the proposed sparse ConvNet model significantly improves the face recognition performance of the previous state-of-the-art DeepID2+ models given the same training data, while it keeps the performance of the baseline model with only 12% of the original parameters.
Pairwise Linear Regression Classification for Image Set Retrieval	Qingxiang Feng, Yicong Zhou, Rushi Lan; Proceedings of the IEEE Conference on Computer Vision and Pattern Recognition (CVPR), 2016, pp. 4865-4872	https://openaccess.thecvf.com/content_cvpr_2016/papers/Feng_Pairwise_Linear_Regression_CVPR_2016_paper.pdf	This paper proposes the pairwise linear regression classification (PLRC) for image set retrieval. In PLRC, we first define a new concept of the unrelated subspace and introduce two strategies to constitute the unrelated subspace. In order to increase the information of maximizing the query set and the unrelated image set, we introduce a combination metric for two new classifiers based on two constitution strategies of the unrelated subspace. Extensive experiments on six well-known databases prove that the performance of PLRC is better than that of DLRC and several state-of-the-art classifiers for different vision recognition tasks: cluster-based face recognition, video-based face recognition, object recognition and action recognition.
The MegaFace Benchmark: 1 Million Faces for Recognition at Scale	Ira Kemelmacher-Shlizerman, Steven M. Seitz, Daniel Miller, Evan Brossard; Proceedings of the IEEE Conference on Computer Vision and Pattern Recognition (CVPR), 2016, pp. 4873-4882	https://openaccess.thecvf.com/content_cvpr_2016/papers/Kemelmacher-Shlizerman_The_MegaFace_Benchmark_CVPR_2016_paper.pdf	Recent face recognition experiments on a major benchmark LFW show stunning performance--a number of algorithms achieve near to perfect score, surpassing human recognition rates. In this paper, we advocate evaluations at the million scale (LFW includes only 13K photos of 5K people). To this end, we have assembled the MegaFace dataset and created the first MegaFace challenge. Our dataset includes One Million photos that capture more than 690K different individuals. The challenge evaluates performance of algorithms with increasing numbers of "distractors" (going from 10 to 1M) in the gallery set. We present both identification and verification performance, evaluate performance with respect to pose and a person's age, and compare as a function of training data size (#photos and  #people).  We report results of state of the art  and baseline algorithms. The MegaFace dataset, baseline code, and evaluation scripts, are all publicly released for further experimentations at http://megaface.cs.washington.edu.
Learnt Quasi-Transitive Similarity for Retrieval From Large Collections of Faces	Ognjen Arandjelovic; Proceedings of the IEEE Conference on Computer Vision and Pattern Recognition (CVPR), 2016, pp. 4883-4892	https://openaccess.thecvf.com/content_cvpr_2016/papers/Arandjelovic_Learnt_Quasi-Transitive_Similarity_CVPR_2016_paper.pdf	We are interested in identity-based retrieval of face sets from large unlabelled collections acquired in uncontrolled environments. Given a baseline algorithm for measuring the similarity of two face sets, the meta-algorithm introduced in this paper seeks to leverage the structure of the data corpus to make the best use of the available baseline. In particular, we show how partial transitivity of inter-personal similarity can be exploited to improve the retrieval of particularly challenging sets which poorly match the query under the baseline measure. We: (i) describe the use of proxy sets as a means of computing the similarity between two sets, (ii) introduce transitivity meta-features based on the similarity of salient modes of appearance variation between sets, (iii) show how quasi-transitivity can be learnt from such features without any labelling or manual intervention, and (iv) demonstrate the effectiveness of the proposed methodology through experiments on the notoriously challenging YouTube database.
Latent Factor Guided Convolutional Neural Networks for Age-Invariant Face Recognition	Yandong Wen, Zhifeng Li, Yu Qiao; Proceedings of the IEEE Conference on Computer Vision and Pattern Recognition (CVPR), 2016, pp. 4893-4901	https://openaccess.thecvf.com/content_cvpr_2016/papers/Wen_Latent_Factor_Guided_CVPR_2016_paper.pdf	While considerable progresses have been made on face recognition, age-invariant face recognition (AIFR) still remains a major challenge in real world applications of face recognition systems. The major difficulty of AIFR arises from the fact that the facial appearance is subject to significant intra-personal changes caused by the aging process over time. In order to address this problem, we propose a novel deep face recognition framework to learn the age-invariant deep face features through a carefully designed CNN model. To the best of our knowledge, this is the first attempt to show the effectiveness of deep CNNs in advancing the state-of-the-art of AIFR. Extensive experiments are conducted on several public domain face aging datasets (MORPH Album2, FGNET, and CACD-VS) to demonstrate the effectiveness of the proposed model over the state-of-the-art. We also verify the excellent generalization of our new model on the famous LFW dataset.
Functional Faces: Groupwise Dense Correspondence Using Functional Maps	Chao Zhang, William A. P. Smith, Arnaud Dessein, Nick Pears, Hang Dai; Proceedings of the IEEE Conference on Computer Vision and Pattern Recognition (CVPR), 2016, pp. 5033-5041	https://openaccess.thecvf.com/content_cvpr_2016/papers/Zhang_Functional_Faces_Groupwise_CVPR_2016_paper.pdf	In this paper we present a method for computing dense correspondence between a set of 3D face meshes using functional maps. The functional maps paradigm brings with it a number of advantages for face correspondence. First, it allows us to combine various notions of correspondence. We do so by proposing a number of face-specific functions, suited to either within- or between-subject correspondence. Second, we propose a groupwise variant of the method allowing us to compute cycle-consistent functional maps between all faces in a training set. Since functional maps are of much lower dimension than point-to-point correspondences, this is feasible even when the input meshes are very high resolution. Finally, we show how a functional map provides a geometric constraint that can be used to filter feature matches between non-rigidly deforming surfaces.
WIDER FACE: A Face Detection Benchmark	Shuo Yang, Ping Luo, Chen-Change Loy, Xiaoou Tang; Proceedings of the IEEE Conference on Computer Vision and Pattern Recognition (CVPR), 2016, pp. 5525-5533	https://openaccess.thecvf.com/content_cvpr_2016/papers/Yang_WIDER_FACE_A_CVPR_2016_paper.pdf	Face detection is one of the most studied topics in the computer vision community. Much of the progresses have been made by the availability of face detection benchmark datasets. We show that there is a gap between current face detection performance and the real world requirements. To facilitate future face detection research, we introduce the WIDER FACE dataset, which is 10 times larger than existing datasets. The dataset contains rich annotations, including occlusions, poses, event categories, and face bounding boxes. Faces in the proposed dataset are extremely challenging due to large variations in scale, pose and occlusion, as shown in Fig. 1. Furthermore, we show that WIDER FACE dataset is an effective training source for face detection. We benchmark several representative detection systems, providing an overview of state-of-the-art performance and propose a solution to deal with large scale variation. Finally, we discuss common failure cases that worth to be further investigated.
Some Like It Hot - Visual Guidance for Preference Prediction	Rasmus Rothe, Radu Timofte, Luc Van Gool; Proceedings of the IEEE Conference on Computer Vision and Pattern Recognition (CVPR), 2016, pp. 5553-5561	https://openaccess.thecvf.com/content_cvpr_2016/papers/Rothe_Some_Like_It_CVPR_2016_paper.pdf	For people first impressions of someone are of determining importance. They are hard to alter through further information. This begs the question if a computer can reach the same judgement. Earlier research has already pointed out that age, gender, and average attractiveness can be estimated with reasonable precision. We improve the state-of-the-art, but also predict - based on someone's known preferences - how much that particular person is attracted to a novel face. Our computational pipeline comprises a face detector, convolutional neural networks for the extraction of deep features, standard support vector regression for gender, age and facial beauty, and - as the main novelties - visual regularized collaborative filtering to infer inter-person preferences as well as a novel regression technique for handling visual queries without rating history. We validate the method using a very large dataset from a dating site as well as images from celebrities. Our experiments yield convincing results, i.e. we predict 76% of the ratings correctly solely based on an image, and reveal some sociologically relevant conclusions. We also validate our collaborative filtering solution on the standard MovieLens rating dataset, augmented with movie posters, to predict an individual's movie rating. We demonstrate our algorithms on howhot.io which went viral around the Internet with more than 50 million pictures evaluated in the first month.
EmotioNet: An Accurate, Real-Time Algorithm for the Automatic Annotation of a Million Facial Expressions in the Wild	C. Fabian Benitez-Quiroz, Ramprakash Srinivasan, Aleix M. Martinez; Proceedings of the IEEE Conference on Computer Vision and Pattern Recognition (CVPR), 2016, pp. 5562-5570	https://openaccess.thecvf.com/content_cvpr_2016/papers/Benitez-Quiroz_EmotioNet_An_Accurate_CVPR_2016_paper.pdf	Research in face perception and emotion theory requires very large annotated databases of images of facial expressions of emotion. Annotations should include Action Units (AUs) and their intensities as well as emotion category. This goal cannot be readily achieved manually. Herein, we present a novel computer vision algorithm to annotate a large database of one million images of facial expressions of emotion in the wild (i.e., face images downloaded from the Internet). First, we show that this newly proposed algorithm can recognize AUs and their intensities reliably across databases. To our knowledge, this is the first published algorithm to achieve highly-accurate results in the recognition of AUs and their intensities across multiple databases. Our algorithm also runs in real-time (>30 images/second), allowing it to work with large numbers of images and video sequences. Second, we use WordNet to download 1,000,000 images of facial expressions with associated emotion keywords from the Internet. These images are then automatically annotated with AUs, AU intensities and emotion categories by our algorithm. The result is a highly useful database that can be readily queried using semantic descriptions for applications in computer vision, affective computing, social and cognitive psychology and neuroscience; e.g., "show me all the images with happy faces" or "all images with AU 1 at intensity c."
