A Dataset and Benchmark for Large-Scale Multi-Modal Face Anti-Spoofing	Shifeng Zhang,  Xiaobo Wang,  Ajian Liu,  Chenxu Zhao,  Jun Wan,  Sergio Escalera,  Hailin Shi,  Zezheng Wang,  Stan Z. Li; Proceedings of the IEEE/CVF Conference on Computer Vision and Pattern Recognition (CVPR), 2019, pp. 919-928	https://openaccess.thecvf.com/content_CVPR_2019/papers/Zhang_A_Dataset_and_Benchmark_for_Large-Scale_Multi-Modal_Face_Anti-Spoofing_CVPR_2019_paper.pdf	Face anti-spoofing is essential to prevent face recognition systems from a security breach. Much of the progresses have been made by the availability of face anti-spoofing benchmark datasets in recent years. However, existing face anti-spoofing benchmarks have limited number of subjects (<=170) and modalities (<=2), which hinder the further development of the academic community. To facilitate face anti-spoofing research, we introduce a large-scale multi-modal dataset, namely CASIA-SURF, which is the largest publicly available dataset for face anti-spoofing in terms of both subjects and visual modalities. Specifically, it consists of 1,000 subjects with 21,000 videos and each sample has 3 modalities (i.e., RGB, Depth and IR). We also provide a measurement set, evaluation protocol and training/validation/testing subsets, developing a new benchmark for face anti-spoofing. Moreover, we present a new multi-modal fusion method as baseline, which performs feature re-weighting to select the more informative channel features while suppressing the less useful ones for each modal. Extensive experiments have been conducted on the proposed dataset to verify its significance and generalization capability. The dataset is available at https://sites.google.com/qq.com/chalearnfacespoofingattackdete/.
MVF-Net: Multi-View 3D Face Morphable Model Regression	Fanzi Wu,  Linchao Bao,  Yajing Chen,  Yonggen Ling,  Yibing Song,  Songnan Li,  King Ngi Ngan,  Wei Liu; Proceedings of the IEEE/CVF Conference on Computer Vision and Pattern Recognition (CVPR), 2019, pp. 959-968	https://openaccess.thecvf.com/content_CVPR_2019/papers/Wu_MVF-Net_Multi-View_3D_Face_Morphable_Model_Regression_CVPR_2019_paper.pdf	We address the problem of recovering the 3D geometry of a human face from a set of facial images in multiple views. While recent studies have shown impressive progress in 3D Morphable Model (3DMM) based facial reconstruction, the settings are mostly restricted to a single view. There is an inherent drawback in the single-view setting: the lack of reliable 3D constraints can cause unresolvable ambiguities.  We in this paper explore 3DMM-based shape recovery in a different setting, where a set of multi-view facial images are given as input. A novel approach is proposed to regress 3DMM parameters from multi-view inputs with an end-to-end trainable Convolutional Neural Network (CNN). Multi-view geometric constraints are incorporated into the network by establishing dense correspondences between different views leveraging a novel self-supervised view alignment loss. The main ingredient of the view alignment loss is a differentiable dense optical flow estimator that can backpropagate the alignment errors between an input view and a synthetic rendering from another input view, which is projected to the target view through the 3D shape to be inferred. Through minimizing the view alignment loss, better 3D shapes can be recovered such that the synthetic projections from one view to another can better align with the observed image. Extensive experiments demonstrate the superiority of the proposed method over other 3DMM methods.
Dense 3D Face Decoding Over 2500FPS: Joint Texture & Shape Convolutional Mesh Decoders	Yuxiang Zhou,  Jiankang Deng,  Irene Kotsia,  Stefanos Zafeiriou; Proceedings of the IEEE/CVF Conference on Computer Vision and Pattern Recognition (CVPR), 2019, pp. 1097-1106	https://openaccess.thecvf.com/content_CVPR_2019/papers/Zhou_Dense_3D_Face_Decoding_Over_2500FPS_Joint_Texture__Shape_CVPR_2019_paper.pdf	3D Morphable Models (3DMMs) are statistical models that represent facial texture and shape variations using a set of linear bases and more particular Principal Component Analysis (PCA). 3DMMs were used as statistical priors for reconstructing 3D faces from images by solving non-linear least square optimization problems. Recently, 3DMMs were used as generative models for training non-linear mappings (i.e., regressors) from image to the parameters of the models via Deep Convolutional Neural Networks (DCNNs). Nevertheless, all of the above methods use either fully connected layers or 2D convolutions on parametric unwrapped UV spaces leading to large networks with many parameters. In this paper, we present the first, to the best of our knowledge, non-linear 3DMMs by learning joint texture and shape auto-encoders using direct mesh convolutions. We demonstrate how these auto-encoders can be used to train very light-weight models that perform Coloured Mesh Decoding (CMD) in-the-wild at a speed of over 2500 FPS.
Linkage Based Face Clustering via Graph Convolution Network	Zhongdao Wang,  Liang Zheng,  Yali Li,  Shengjin Wang; Proceedings of the IEEE/CVF Conference on Computer Vision and Pattern Recognition (CVPR), 2019, pp. 1117-1125	https://openaccess.thecvf.com/content_CVPR_2019/papers/Wang_Linkage_Based_Face_Clustering_via_Graph_Convolution_Network_CVPR_2019_paper.pdf	In this paper, we present an accurate and scalable approach to the face clustering task. We aim at grouping a set of faces by their potential identities. We formulate this task as a link prediction problem: a link exists between two faces if they are of the same identity. The key idea is that we find the local context in the feature space around an instance (face) contains rich information about the linkage relationship between this instance and its neighbors. By constructing sub-graphs around each instance as input data, which depict the local context, we utilize the graph convolution network (GCN) to perform reasoning and infer the likelihood of linkage between pairs in the sub-graphs. Experiments show that our method is more robust to the complex distribution of faces than conventional methods, yielding favorably comparable results to state-of-the-art methods on standard face clustering benchmarks, and is scalable to large datasets. Furthermore, we show that the proposed method does not need the number of clusters as prior, is aware of noises and outliers, and can be extended to a multi-view version for more accurate clustering accuracy.
RegularFace: Deep Face Recognition via Exclusive Regularization	Kai Zhao,  Jingyi Xu,  Ming-Ming Cheng; Proceedings of the IEEE/CVF Conference on Computer Vision and Pattern Recognition (CVPR), 2019, pp. 1136-1144	https://openaccess.thecvf.com/content_CVPR_2019/papers/Zhao_RegularFace_Deep_Face_Recognition_via_Exclusive_Regularization_CVPR_2019_paper.pdf	We consider the face recognition task where facial images of the same identity (person) is expected to be closer in the representation space, while different identities be far apart. Several recent studies encourage the intra-class compactness by developing loss functions that penalize the variance of representations of the same identity. In this paper, we propose the `exclusive regularization'  that focuses on the other aspect of discriminability --  the inter-class separability,  which is neglected in many recent approaches. The proposed method, named RegularFace, explicitly distances identities by penalizing the angle between an identity and its nearest neighbor, resulting in discriminative face representations. Our method has intuitive geometric interpretation and presents unique benefits that are absent in previous works. Quantitative comparisons against prior methods on several open benchmarks demonstrate the superiority of our method. In addition, our method is easy to implement and requires only a few lines of python code on modern deep learning frameworks.
BridgeNet: A Continuity-Aware Probabilistic Network for Age Estimation	Wanhua Li,  Jiwen Lu,  Jianjiang Feng,  Chunjing Xu,  Jie Zhou,  Qi Tian; Proceedings of the IEEE/CVF Conference on Computer Vision and Pattern Recognition (CVPR), 2019, pp. 1145-1154	https://openaccess.thecvf.com/content_CVPR_2019/papers/Li_BridgeNet_A_Continuity-Aware_Probabilistic_Network_for_Age_Estimation_CVPR_2019_paper.pdf	Age estimation is an important yet very challenging problem in computer vision. Existing methods for age estimation usually apply a divide-and-conquer strategy to deal with heterogeneous data caused by the non-stationary aging process. However, the facial aging process is also a continuous process, and the continuity relationship between different components has not been effectively exploited. In this paper, we propose BridgeNet for age estimation, which aims to mine the continuous relation between age labels effectively. The proposed BridgeNet consists of local regressors and gating networks. Local regressors partition the data space into multiple overlapping subspaces to tackle heterogeneous data and gating networks learn continuity aware weights for the results of local regressors by employing the proposed bridge-tree structure, which introduces bridge connections into tree models to enforce the similarity between neighbor nodes. Moreover, these two components of BridgeNet can be jointly learned in an end-to-end way. We show experimental results on the MORPH II, FG-NET and Chalearn LAP 2015 datasets and find that BridgeNet outperforms the state-of-the-art methods.
GANFIT: Generative Adversarial Network Fitting for High Fidelity 3D Face Reconstruction	Baris Gecer,  Stylianos Ploumpis,  Irene Kotsia,  Stefanos Zafeiriou; Proceedings of the IEEE/CVF Conference on Computer Vision and Pattern Recognition (CVPR), 2019, pp. 1155-1164	https://openaccess.thecvf.com/content_CVPR_2019/papers/Gecer_GANFIT_Generative_Adversarial_Network_Fitting_for_High_Fidelity_3D_Face_CVPR_2019_paper.pdf	In the past few years, a lot of work has been done towards reconstructing the 3D facial structure from single images by capitalizing on the power of Deep Convolutional Neural Networks (DCNNs). In the most recent works, differentiable renderers were employed in order to learn the relationship between the facial identity features and the parameters of a 3D morphable model for shape and texture. The texture features either correspond to components of a linear texture space or are learned by auto-encoders directly from in-the-wild images. In all cases, the quality of the facial texture reconstruction of the state-of-the-art methods is still not capable of modeling textures in high fidelity. In this paper, we take a radically different approach and harness the power of Generative Adversarial Networks (GANs) and DCNNs in order to reconstruct the facial texture and shape from single images. That is, we utilize GANs to train a very powerful generator of facial texture in UV space. Then, we revisit the original 3D Morphable Models (3DMMs) fitting approaches making use of non-linear optimization to find the optimal latent parameters that best reconstruct the test image but under a new perspective. We optimize the parameters with the supervision of pretrained deep identity features through our end-to-end differentiable framework. We demonstrate excellent results in photorealistic and identity preserving 3D face reconstructions and achieve for the first time, to the best of our knowledge, facial texture reconstruction with high-frequency details.
Learning to Cluster Faces on an Affinity Graph	Lei Yang,  Xiaohang Zhan,  Dapeng Chen,  Junjie Yan,  Chen Change Loy,  Dahua Lin; Proceedings of the IEEE/CVF Conference on Computer Vision and Pattern Recognition (CVPR), 2019, pp. 2298-2306	https://openaccess.thecvf.com/content_CVPR_2019/papers/Yang_Learning_to_Cluster_Faces_on_an_Affinity_Graph_CVPR_2019_paper.pdf	Face recognition sees remarkable progress in recent years, and its performance has reached a very high level. Taking it to a next level requires substantially larger data, which would involve prohibitive annotation cost. Hence, exploiting unlabeled data becomes an appealing alternative. Recent works have shown that clustering unlabeled faces is a promising approach, often leading to notable performance gains. Yet, how to effectively cluster, especially on a large-scale (i.e. million-level or above) dataset, remains an open question. A key challenge lies in the complex variations of cluster patterns, which make it difficult for conventional clustering methods to meet the needed accuracy. This work explores a novel approach, namely, learning to cluster instead of relying on hand-crafted criteria. Specifically, we propose a framework based on graph convolutional network, which combines a detection and a segmentation module to pinpoint face clusters. Experiments show that our method yields significantly more accurate face clusters, which, as a result, also lead to further performance gain in face recognition.
UniformFace: Learning Deep Equidistributed Representation for Face Recognition	Yueqi Duan,  Jiwen Lu,  Jie Zhou; Proceedings of the IEEE/CVF Conference on Computer Vision and Pattern Recognition (CVPR), 2019, pp. 3415-3424	https://openaccess.thecvf.com/content_CVPR_2019/papers/Duan_UniformFace_Learning_Deep_Equidistributed_Representation_for_Face_Recognition_CVPR_2019_paper.pdf	In this paper, we propose a new supervision objective named uniform loss to learn deep equidistributed representations for face recognition. Most existing methods aim to learn discriminative face features, encouraging large inter-class distances and small intra-class variations. However, they ignore the distribution of faces in the holistic feature space, which may lead to severe locality and unbalance. With the prior that faces lie on a hypersphere manifold, we impose an equidistributed constraint by uniformly spreading the class centers on the manifold, so that the minimum distance between class centers can be maximized through complete exploitation of the feature space. To this end, we consider the class centers as like charges on the surface of hypersphere with inter-class repulsion, and minimize the total electric potential energy as the uniform loss. Extensive experimental results on the MegaFace Challenge I, IARPA Janus Benchmark A (IJB-A), Youtube Faces (YTF) and Labeled Faces in the Wild (LFW) datasets show the effectiveness of the proposed uniform loss.
Mask-Guided Portrait Editing With Conditional GANs	Shuyang Gu,  Jianmin Bao,  Hao Yang,  Dong Chen,  Fang Wen,  Lu Yuan; Proceedings of the IEEE/CVF Conference on Computer Vision and Pattern Recognition (CVPR), 2019, pp. 3436-3445	https://openaccess.thecvf.com/content_CVPR_2019/papers/Gu_Mask-Guided_Portrait_Editing_With_Conditional_GANs_CVPR_2019_paper.pdf	Portrait editing is a popular subject in photo manipulation.The Generative Adversarial Network (GAN) advances the generating of realistic faces and allows more face editing. In this paper, we argue about three issues in existing techniques: diversity, quality, and controllability for portrait synthesis and editing. To address these issues, we propose a novel end-to-end learning framework that leverages conditional GANs guided by provided face masks for generating faces. The framework learns feature embeddings for every face component (e.g., mouth, hair, eye), separately, contributing to better correspondences for image translation, and local face editing. With the mask, our network is available to many applications, like face synthesis driven by mask, face Swap+ (including hair in swapping), and local manipulation. It can also boost the performance of face parsing a bit as an option of data augmentation.
Group Sampling for Scale Invariant Face Detection	Xiang Ming,  Fangyun Wei,  Ting Zhang,  Dong Chen,  Fang Wen; Proceedings of the IEEE/CVF Conference on Computer Vision and Pattern Recognition (CVPR), 2019, pp. 3446-3456	https://openaccess.thecvf.com/content_CVPR_2019/papers/Ming_Group_Sampling_for_Scale_Invariant_Face_Detection_CVPR_2019_paper.pdf	Detectors based on deep learning tend to detect multi-scale faces on a single input image for efficiency. Recent works, such as FPN and SSD, generally use feature maps from multiple layers with different spatial resolutions to detect objects at different scales, e.g., high-resolution feature maps for small objects. However, we find that such multi-layer prediction is not necessary. Faces at all scales can be well detected with features from a single layer of the network. In this paper, we carefully examine the factors affecting face detection across a large range of scales, and conclude that the balance of training samples, including both positive and negative ones, at different scales is the key. We propose a group sampling method which divides the anchors into several groups according to the scale, and ensure that the number of samples for each group is the same during training. Our approach using only the last layer of FPN as features is able to advance the state-of-the-arts. Comprehensive analysis and extensive experiments have been conducted to show the effectiveness of the proposed method. Our approach, evaluated on face detection benchmarks including FDDB and WIDER FACE datasets, achieves state-of-the-art results without bells and whistles.
Joint Representation and Estimator Learning for Facial Action Unit Intensity Estimation	Yong Zhang,  Baoyuan Wu,  Weiming Dong,  Zhifeng Li,  Wei Liu,  Bao-Gang Hu,  Qiang Ji; Proceedings of the IEEE/CVF Conference on Computer Vision and Pattern Recognition (CVPR), 2019, pp. 3457-3466	https://openaccess.thecvf.com/content_CVPR_2019/papers/Zhang_Joint_Representation_and_Estimator_Learning_for_Facial_Action_Unit_Intensity_CVPR_2019_paper.pdf	Facial action unit (AU) intensity is an index to characterize human expressions. Accurate AU intensity estimation depends on three major elements: image representation, intensity estimator, and supervisory information. Most existing methods learn intensity estimator with fixed image representation, and rely on the availability of fully annotated supervisory information. In this paper, a novel general framework for AU intensity estimation is presented, which differs from traditional estimation methods in two aspects. First, rather than keeping image representation fixed, it simultaneously learns representation and intensity estimator to achieve an optimal solution. Second, it allows incorporating weak supervisory training signal from human knowledge (e.g. feature smoothness, label smoothness, label ranking, and positive label), which makes our model trainable even fully annotated information is not available. More specifically, human knowledge is represented as either soft or hard constraints which are encoded as regularization terms or equality/inequality constraints, respectively. On top of our novel framework, we additionally propose an efficient algorithm for optimization based on Alternating Direction Method of Multipliers (ADMM). Evaluations on two benchmark databases show that our method outperforms competing methods under different ratios of AU intensity annotations, especially for small ratios.
Face Anti-Spoofing: Model Matters, so Does Data	Xiao Yang,  Wenhan Luo,  Linchao Bao,  Yuan Gao,  Dihong Gong,  Shibao Zheng,  Zhifeng Li,  Wei Liu; Proceedings of the IEEE/CVF Conference on Computer Vision and Pattern Recognition (CVPR), 2019, pp. 3507-3516	https://openaccess.thecvf.com/content_CVPR_2019/papers/Yang_Face_Anti-Spoofing_Model_Matters_so_Does_Data_CVPR_2019_paper.pdf	Face anti-spoofing is an important task in full-stack face applications including face detection, verification, and recognition. Previous approaches build models on datasets which do not simulate the real-world data well (e.g., small scale, insignificant variance, etc.). Existing models may rely on auxiliary information, which prevents these anti-spoofing solutions from generalizing well in practice. In this paper, we present a data collection solution along with a data synthesis technique to simulate digital medium-based face spoofing attacks, which can easily help us obtain a large amount of training data well reflecting the real-world scenarios. Through exploiting a novel Spatio-Temporal Anti-Spoof Network (STASN), we are able to push the performance on public face anti-spoofing datasets over state-of-the-art methods by a large margin. Since the proposed model can automatically attend to discriminative regions, it makes analyzing the behaviors of the network possible.We conduct extensive experiments and show that the proposed model can distinguish spoof faces by extracting features from a variety of regions to seek out subtle evidences such as borders, moire patterns, reflection artifacts, etc.
Self-Supervised Adaptation of High-Fidelity Face Models for Monocular Performance Tracking	Jae Shin Yoon,  Takaaki Shiratori,  Shoou-I Yu,  Hyun Soo Park; Proceedings of the IEEE/CVF Conference on Computer Vision and Pattern Recognition (CVPR), 2019, pp. 4601-4609	https://openaccess.thecvf.com/content_CVPR_2019/papers/Yoon_Self-Supervised_Adaptation_of_High-Fidelity_Face_Models_for_Monocular_Performance_Tracking_CVPR_2019_paper.pdf	Improvements in data-capture and face modeling techniques have enabled us to create high-fidelity realistic face models. However, driving these realistic face models requires special input data, e.g., 3D meshes and unwrapped textures. Also, these face models expect clean input data taken under controlled lab environments, which is very different from data collected in the wild. All these constraints make it challenging to use the high-fidelity models in tracking for commodity cameras. In this paper, we propose a self-supervised domain adaptation approach to enable the animation of high-fidelity face models from a commodity camera. Our approach first circumvents the requirement for special input data by training a new network that can directly drive a face model just from a single 2D image. Then, we overcome the domain mismatch between lab and uncontrolled environments by performing self-supervised domain adaptation based on "consecutive frame texture consistency" based on the assumption that the appearance of the face is consistent over consecutive frames, avoiding the necessity of modeling the new environment such as lighting or background. Experiments show that we are able to drive a high-fidelity face model to perform complex facial motion from a cellphone camera without requiring any labeled data from the new domain.
Deep Tree Learning for Zero-Shot Face Anti-Spoofing	Yaojie Liu,  Joel Stehouwer,  Amin Jourabloo,  Xiaoming Liu; Proceedings of the IEEE/CVF Conference on Computer Vision and Pattern Recognition (CVPR), 2019, pp. 4680-4689	https://openaccess.thecvf.com/content_CVPR_2019/papers/Liu_Deep_Tree_Learning_for_Zero-Shot_Face_Anti-Spoofing_CVPR_2019_paper.pdf	Face anti-spoofing is designed to keep face recognition systems from recognizing fake faces as the genuine users. While advanced face anti-spoofing methods are developed, new types of spoof attacks are also being created and becoming a threat to all existing systems. We define the detection of unknown spoof attacks as Zero-Shot Face Anti-spoofing (ZSFA). Previous works of ZSFA only study 1-2 types of spoof attacks, such as print/replay attacks, which limits the insight of this problem. In this work, we expand the ZSFA problem to a wide range of 13 types of spoof attacks, including print attack, replay attack, 3D mask attacks, and so on. A novel Deep Tree Network (DTN) is proposed to tackle the ZSFA. The tree is learned to partition the spoof samples into semantic sub-groups in an unsupervised fashion. When a data sample arrives, being know or unknown attacks, DTN routes it to the most similar spoof cluster, and make the binary decision. In addition, to enable the study of ZSFA, we introduce the first face anti-spoofing database that contains diverse types of spoof attacks. Experiments show that our proposed method achieves the state of the art on multiple testing protocols of ZSFA.
