Facial Emotion Distribution Learning by Exploiting Low-Rank Label Correlations Locally	Xiuyi Jia,  Xiang Zheng,  Weiwei Li,  Changqing Zhang,  Zechao Li; Proceedings of the IEEE/CVF Conference on Computer Vision and Pattern Recognition (CVPR), 2019, pp. 9841-9850	https://openaccess.thecvf.com/content_CVPR_2019/papers/Jia_Facial_Emotion_Distribution_Learning_by_Exploiting_Low-Rank_Label_Correlations_Locally_CVPR_2019_paper.pdf	Emotion recognition from facial expressions is an interesting and challenging problem and has attracted much attention in recent years. Substantial previous research has only been able to address the ambiguity of "what describes the expression", which assumes that each facial expression is associated with one or more predefined affective labels while ignoring the fact that multiple emotions always have different intensities in a single picture. Therefore, to depict facial expressions more accurately, this paper adopts a label distribution learning approach for emotion recognition that can address the ambiguity of "how to describe the expression" and proposes an emotion distribution learning method that exploits label correlations locally. Moreover, a local low-rank structure is employed to capture the local label correlations implicitly. Experiments on benchmark facial expression datasets demonstrate that our method can better address the emotion distribution recognition problem than state-of-the-art methods.
Unsupervised Face Normalization With Extreme Pose and Expression in the Wild	Yichen Qian,  Weihong Deng,  Jiani Hu; Proceedings of the IEEE/CVF Conference on Computer Vision and Pattern Recognition (CVPR), 2019, pp. 9851-9858	https://openaccess.thecvf.com/content_CVPR_2019/papers/Qian_Unsupervised_Face_Normalization_With_Extreme_Pose_and_Expression_in_the_CVPR_2019_paper.pdf	Face recognition achieves great success thanks to the emergence of deep learning. However, many contemporary face recognition models still have limited invariance to strong intra-personal variations such as large pose changes. Face normalization provides an effective and cheap way to distil face identity and dispel face variances for recognition. We focus on face generation in the wild with unpaired data. To this end, we propose a Face Normalization Model (FNM) to generate a frontal, neutral expression, photorealistic face image for face recognition. FNM is a well-designed Generative Adversarial Network (GAN) with three distinct novelties. First, a face expert network is introduced to construct generator and provide the ability of retaining face identity. Second, with the reconstruction of normal face, pixel-wise loss is applied to stabilize optimization process. Third, we present a series of face attention discriminators to refine local textures. FNM could recover canonical-view, expression-free image and directly improve the performance of face recognition model. Extensive qualitative and quantitative experiments on both controlled and in-the-wild databases demonstrate the superiority of our face normalization method.
R3 Adversarial Network for Cross Model Face Recognition	Ken Chen,  Yichao Wu,  Haoyu Qin,  Ding Liang,  Xuebo Liu,  Junjie Yan; Proceedings of the IEEE/CVF Conference on Computer Vision and Pattern Recognition (CVPR), 2019, pp. 9868-9876	https://openaccess.thecvf.com/content_CVPR_2019/papers/Chen_R3_Adversarial_Network_for_Cross_Model_Face_Recognition_CVPR_2019_paper.pdf	In this paper, we raise a new problem, namely cross model face recognition (CMFR), which has considerable economic and social significance. The core of this problem is to make features extracted from different models comparable. However, the diversity, mainly caused by different application scenarios, frequent version updating, and all sorts of service platforms, obstructs interaction among different models and poses a great challenge. To solve this problem, from the perspective of Bayesian modelling, we propose R3 Adversarial Network (R3AN) which consists of three paths: Reconstruction, Representation and Regression. We also introduce adversarial learning into the reconstruction path for better performance. Comprehensive experiments on public datasets demonstrate the feasibility of interaction among different models with the proposed framework. When updating the gallery, R3AN conducts the feature transformation nearly 10 times faster than ResNet-101.  Meanwhile, the transformed feature distribution is very close to that of target model, and its error rate is incredibly reduced by approximately 75% compared with a naive transformation model. Furthermore, we show that face feature can be deciphered into original face image roughly by the reconstruction path, which may give valuable hints for improving the original face recognition models.
Semantic Component Decomposition for Face Attribute Manipulation	Ying-Cong Chen,  Xiaohui Shen,  Zhe Lin,  Xin Lu,  I-Ming Pao,  Jiaya Jia; Proceedings of the IEEE/CVF Conference on Computer Vision and Pattern Recognition (CVPR), 2019, pp. 9859-9867	https://openaccess.thecvf.com/content_CVPR_2019/papers/Chen_Semantic_Component_Decomposition_for_Face_Attribute_Manipulation_CVPR_2019_paper.pdf	Deep neural network-based methods were proposed for face attribute manipulation. There still exist, however, two major issues, i.e., insufficient visual quality (or resolution) of the results and lack of user control. They limit the applicability of existing methods since users may have different editing preference on facial attributes. In this paper, we address these issues by proposing a semantic component model. The model decomposes a facial attribute into multiple semantic components, each corresponds to a specific face region. This not only allows for user control of edit strength on different parts based on their preference, but also makes it effective to remove unwanted edit effect. Further, each semantic component is composed of two fundamental elements, which determine the edit effect and region respectively. This property provides fine interactive control. As shown in experiments, our model not only produces high-quality results, but also allows effective user interaction.
Automatic Face Aging in Videos via Deep Reinforcement Learning	Chi Nhan Duong,  Khoa Luu,  Kha Gia Quach,  Nghia Nguyen,  Eric Patterson,  Tien D. Bui,  Ngan Le; Proceedings of the IEEE/CVF Conference on Computer Vision and Pattern Recognition (CVPR), 2019, pp. 10013-10022	https://openaccess.thecvf.com/content_CVPR_2019/papers/Duong_Automatic_Face_Aging_in_Videos_via_Deep_Reinforcement_Learning_CVPR_2019_paper.pdf	This paper presents a novel approach for synthesizing automatically age-progressed facial images in video sequences using Deep Reinforcement Learning. The proposed method models facial structures and the longitudinal face-aging process of given subjects coherently across video frames. The approach is optimized using a long-term reward,  Reinforcement Learning function with deep feature extraction from Deep Convolutional Neural Network. Unlike previous age-progression methods that are only able to synthesize an aged likeness of a face from a single input image, the proposed approach is capable of age-progressing facial likenesses in videos with consistently synthesized facial features across frames. In addition, the deep reinforcement learning method guarantees preservation of the visual identity of input faces after age-progression. Results on videos of our new collected aging face AGFW-v2 database demonstrate the advantages of the  proposed solution in terms of both quality of age-progressed faces, temporal smoothness, and cross-age face verification.
Multi-Adversarial Discriminative Deep Domain Generalization for Face Presentation Attack Detection	Rui Shao,  Xiangyuan Lan,  Jiawei Li,  Pong C. Yuen; Proceedings of the IEEE/CVF Conference on Computer Vision and Pattern Recognition (CVPR), 2019, pp. 10023-10031	https://openaccess.thecvf.com/content_CVPR_2019/papers/Shao_Multi-Adversarial_Discriminative_Deep_Domain_Generalization_for_Face_Presentation_Attack_Detection_CVPR_2019_paper.pdf	Face presentation attacks have become an increasingly critical issue in the face recognition community. Many face anti-spoofing methods have been proposed, but they cannot generalize well on "unseen" attacks. This work focuses on improving the generalization ability of face anti-spoofing methods from the perspective of the domain generalization. We propose to learn a generalized feature space via a novel multi-adversarial discriminative deep domain generalization framework. In this framework, a multi-adversarial deep domain generalization is performed under a dual-force triplet-mining constraint. This ensures that the learned feature space is discriminative and shared by multiple source domains, and thus is more generalized to new face presentation attacks. An auxiliary face depth supervision is incorporated to further enhance the generalization ability. Extensive experiments on four public datasets validate the effectiveness of the proposed method.
BeautyGlow: On-Demand Makeup Transfer Framework With Reversible Generative Network	Hung-Jen Chen,  Ka-Ming Hui,  Szu-Yu Wang,  Li-Wu Tsao,  Hong-Han Shuai,  Wen-Huang Cheng; Proceedings of the IEEE/CVF Conference on Computer Vision and Pattern Recognition (CVPR), 2019, pp. 10042-10050	https://openaccess.thecvf.com/content_CVPR_2019/papers/Chen_BeautyGlow_On-Demand_Makeup_Transfer_Framework_With_Reversible_Generative_Network_CVPR_2019_paper.pdf	As makeup has been widely-adopted for beautification, finding suitable makeup by virtual makeup applications becomes popular. Therefore, a recent line of studies proposes to transfer the makeup from a given reference makeup image to the source non-makeup one. However, it is still challenging due to the massive number of makeup combinations. To facilitate on-demand makeup transfer, in this work, we propose BeautyGlow that decompose the latent vectors of face images derived from the Glow model into makeup and non-makeup latent vectors. Since there is no paired dataset, we formulate a new loss function to guide the decomposition. Afterward, the non-makeup latent vector of a source image and makeup latent vector of a reference image and are effectively combined and revert back to the image domain to derive the results. Experimental results show that the transfer quality of BeautyGlow is comparable to the state-of-the-art methods, while the unique ability to manipulate latent vectors allows BeautyGlow to realize on-demand makeup transfer.
Capture, Learning, and Synthesis of 3D Speaking Styles	Daniel Cudeiro,  Timo Bolkart,  Cassidy Laidlaw,  Anurag Ranjan,  Michael J. Black; Proceedings of the IEEE/CVF Conference on Computer Vision and Pattern Recognition (CVPR), 2019, pp. 10101-10111	https://openaccess.thecvf.com/content_CVPR_2019/papers/Cudeiro_Capture_Learning_and_Synthesis_of_3D_Speaking_Styles_CVPR_2019_paper.pdf	Audio-driven 3D facial animation has been widely explored, but achieving realistic, human-like performance is still unsolved. This is due to the lack of available 3D datasets, models, and standard evaluation metrics. To address this, we introduce a unique 4D face dataset with about 29 minutes of 4D scans captured at 60 fps and synchronized audio from 12 speakers. We then train a neural network on our dataset that factors identity from facial motion. The learned model, VOCA (Voice Operated Character Animation) takes any speech signal as input--even speech in languages other than English--and realistically animates a wide range of adult faces. Conditioning on subject labels during training allows the model to learn a variety of realistic speaking styles. VOCA also provides animator controls to alter speaking style, identity-dependent facial shape, and pose (i.e. head, jaw, and eyeball rotations) during animation. To our knowledge, VOCA is the only realistic 3D facial animation model that is readily applicable to unseen subjects without retargeting. This makes VOCA suitable for tasks like in-game video, virtual reality avatars, or any scenario in which the speaker, speech, or language is not known in advance. We make the dataset and model available for research purposes at http://voca.is.tue.mpg.de.
FBNet: Hardware-Aware Efficient ConvNet Design via Differentiable Neural Architecture Search	Bichen Wu,  Xiaoliang Dai,  Peizhao Zhang,  Yanghan Wang,  Fei Sun,  Yiming Wu,  Yuandong Tian,  Peter Vajda,  Yangqing Jia,  Kurt Keutzer; Proceedings of the IEEE/CVF Conference on Computer Vision and Pattern Recognition (CVPR), 2019, pp. 10734-10742	https://openaccess.thecvf.com/content_CVPR_2019/papers/Wu_FBNet_Hardware-Aware_Efficient_ConvNet_Design_via_Differentiable_Neural_Architecture_Search_CVPR_2019_paper.pdf	Designing accurate and efficient ConvNets for mobile devices is challenging because the design space is combinatorially large. Due to this, previous neural architecture search (NAS) methods are computationally expensive. ConvNet architecture optimality depends on factors such as input resolution and target devices. However, existing approaches are too resource demanding for case-by-case redesigns. Also, previous work focuses primarily on reducing FLOPs, but FLOP count does not always reflect actual latency. To address these, we propose a differentiable neural architecture search (DNAS) framework that uses gradient-based methods to optimize ConvNet architectures, avoiding enumerating and training individual architectures separately as in previous methods. FBNets (Facebook-Berkeley-Nets), a family of models discovered by DNAS surpass state-of-the-art models both designed manually and generated automatically. FBNet-B achieves 74.1% top-1 accuracy on ImageNet with 295M FLOPs and 23.1 ms latency on a Samsung S8 phone, 2.4x smaller and 1.5x faster than MobileNetV2-1.3 with similar accuracy. Despite higher accuracy and lower latency than MnasNet, we estimate FBNet-B's search cost is 420x smaller than MnasNet's, at only 216 GPU-hours. Searched for different resolutions and channel sizes, FBNets achieve 1.5% to 6.4% higher accuracy than MobileNetV2. The smallest FBNet achieves 50.2% accuracy and 2.9 ms latency (345 frames per second) on a Samsung S8. Over a Samsung-optimized FBNet, the iPhone-X-optimized model achieves a 1.4x speedup on an iPhone X. FBNet models are open-sourced at https://github. com/facebookresearch/mobile-vision.
WarpGAN: Automatic Caricature Generation	Yichun Shi,  Debayan Deb,  Anil K. Jain; Proceedings of the IEEE/CVF Conference on Computer Vision and Pattern Recognition (CVPR), 2019, pp. 10762-10771	https://openaccess.thecvf.com/content_CVPR_2019/papers/Shi_WarpGAN_Automatic_Caricature_Generation_CVPR_2019_paper.pdf	We propose, WarpGAN, a fully automatic network that can generate caricatures given an input face photo. Besides transferring rich texture styles, WarpGAN learns to automatically predict a set of control points that can warp the photo into a caricature, while preserving identity. We introduce an identity-preserving adversarial loss that aids the discriminator to distinguish between different subjects. Moreover, WarpGAN allows customization of the generated caricatures by controlling the exaggeration extent and the visual styles. Experimental results on a public domain dataset, WebCaricature, show that WarpGAN is capable of generating caricatures that not only preserve the identities but also outputs a diverse set of caricatures for each input photo. Five caricature experts suggest that caricatures generated by WarpGAN are visually similar to hand-drawn ones and only prominent facial features are exaggerated.
High-Quality Face Capture Using Anatomical Muscles	Michael Bao,  Matthew Cong,  Stephane Grabli,  Ronald Fedkiw; Proceedings of the IEEE/CVF Conference on Computer Vision and Pattern Recognition (CVPR), 2019, pp. 10802-10811	https://openaccess.thecvf.com/content_CVPR_2019/papers/Bao_High-Quality_Face_Capture_Using_Anatomical_Muscles_CVPR_2019_paper.pdf	Muscle-based systems have the potential to provide both anatomical accuracy and semantic interpretability as compared to blendshape models; however, a lack of expressivity and differentiability has limited their impact. Thus, we propose modifying a recently developed rather expressive muscle-based system in order to make it fully-differentiable; in fact, our proposed modifications allow this physically robust and anatomically accurate muscle model to conveniently be driven by an underlying blendshape basis. Our formulation is intuitive, natural, as well as monolithically and fully coupled such that one can differentiate the model from end to end, which makes it viable for both optimization and learning-based approaches for a variety of applications. We illustrate this with a number of examples including both shape matching of three-dimensional geometry as as well as the automatic determination of a three-dimensional facial pose from a single two-dimensional RGB image without using markers or depth information.
FML: Face Model Learning From Videos	Ayush Tewari,  Florian Bernard,  Pablo Garrido,  Gaurav Bharaj,  Mohamed Elgharib,  Hans-Peter Seidel,  Patrick Perez,  Michael Zollhofer,  Christian Theobalt; Proceedings of the IEEE/CVF Conference on Computer Vision and Pattern Recognition (CVPR), 2019, pp. 10812-10822	https://openaccess.thecvf.com/content_CVPR_2019/papers/Tewari_FML_Face_Model_Learning_From_Videos_CVPR_2019_paper.pdf	Monocular image-based 3D reconstruction of faces is a long-standing problem in computer vision. Since image data is a 2D projection of a 3D face, the resulting depth ambiguity makes the problem ill-posed. Most existing methods rely on data-driven priors that are built from limited 3D face scans. In contrast, we propose multi-frame video-based self-supervised training of a deep network that (i) learns a face identity model both in shape and appearance while (ii) jointly learning to reconstruct 3D faces. Our face model is learned using only corpora of in-the-wild video clips collected from the Internet. This virtually endless source of training data enables learning of a highly general 3D face model. In order to achieve this, we propose a novel multi-frame consistency loss that ensures consistent shape and appearance across multiple frames of a subject's face, thus minimizing depth ambiguity. At test time we can use an arbitrary number of frames, so that we can perform both monocular as well as multi-frame reconstruction.
Combining 3D Morphable Models: A Large Scale Face-And-Head Model	Stylianos Ploumpis,  Haoyang Wang,  Nick Pears,  William A. P. Smith,  Stefanos Zafeiriou; Proceedings of the IEEE/CVF Conference on Computer Vision and Pattern Recognition (CVPR), 2019, pp. 10934-10943	https://openaccess.thecvf.com/content_CVPR_2019/papers/Ploumpis_Combining_3D_Morphable_Models_A_Large_Scale_Face-And-Head_Model_CVPR_2019_paper.pdf	Three-dimensional Morphable Models (3DMMs) are powerful statistical tools for representing the 3D surfaces of an object class. In this context, we identify an interesting question that has previously not received research attention: is it possible to combine two or more 3DMMs that (a) are built using different templates that perhaps only partly overlap, (b) have different representation capabilities and (c) are built from different datasets that may not be publicly-available? In answering this question, we make two contributions. First, we propose two methods for solving this problem: i. use a regressor to complete missing parts of one model using the other, ii. use the Gaussian Process framework to blend covariance matrices from multiple models. Second, as an example application of our approach, we build a new head and face model that combines the variability and facial detail of the LSFM with the full head modelling of the LYHM. The resulting combined model achieves state-of-the-art performance and outperforms existing head models by a large margin. Finally, as an application experiment, we reconstruct full head representations from single, unconstrained images by utilizing our proposed large-scale model in conjunction with the Face-Warehouse blendshapes for handling expressions.
Boosting Local Shape Matching for Dense 3D Face Correspondence	Zhenfeng Fan,  Xiyuan Hu,  Chen Chen,  Silong Peng; Proceedings of the IEEE/CVF Conference on Computer Vision and Pattern Recognition (CVPR), 2019, pp. 10944-10954	https://openaccess.thecvf.com/content_CVPR_2019/papers/Fan_Boosting_Local_Shape_Matching_for_Dense_3D_Face_Correspondence_CVPR_2019_paper.pdf	Dense 3D face correspondence is a fundamental and challenging issue in the literature of 3D face analysis. Correspondence between two 3D faces can be viewed as a non-rigid registration problem that one deforms into the other, which is commonly guided by a few facial landmarks in many existing works. However, the current works seldom consider the problem of incoherent deformation caused by landmarks. In this paper, we explicitly formulate the deformation as locally rigid motions guided by some seed points, and the formulated deformation satisfies coherent local motions everywhere on a face. The seed points are initialized by a few landmarks, and are then augmented to boost shape matching between the template and the target face step by step, to finally achieve dense correspondence. In each step, we employ a hierarchical scheme for local shape registration, together with a Gaussian reweighting strategy for accurate matching of local features around the seed points. In our experiments, we evaluate the proposed method extensively on several datasets, including two publicly available ones: FRGC v2.0 and BU-3DFE. The experimental results demonstrate that our method can achieve accurate feature correspondence, coherent local shape motion, and compact data representation. These merits actually settle some important issues for practical applications, such as expressions, noise, and partial data.
Attribute-Aware Face Aging With Wavelet-Based Generative Adversarial Networks	Yunfan Liu,  Qi Li,  Zhenan Sun; Proceedings of the IEEE/CVF Conference on Computer Vision and Pattern Recognition (CVPR), 2019, pp. 11877-11886	https://openaccess.thecvf.com/content_CVPR_2019/papers/Liu_Attribute-Aware_Face_Aging_With_Wavelet-Based_Generative_Adversarial_Networks_CVPR_2019_paper.pdf	Since it is difficult to collect face images of the same subject over a long range of age span, most existing face aging methods resort to unpaired datasets to learn age mappings. However, the matching ambiguity between young and aged face images inherent to unpaired training data may lead to unnatural changes of facial attributes during the aging process, which could not be solved by only enforcing identity consistency like most existing studies do. In this paper, we propose an attribute-aware face aging model with wavelet based Generative Adversarial Networks (GANs) to address the above issues. To be specific, we embed facial attribute vectors into both the generator and discriminator of the model to encourage each synthesized elderly face image to be faithful to the attribute of its corresponding input. In addition, a wavelet packet transform (WPT) module is incorporated to improve the visual fidelity of generated images by capturing age-related texture details at multiple scales in the frequency space. Qualitative results demonstrate the ability of our model in synthesizing visually plausible face images, and extensive quantitative evaluation results show that the proposed method achieves state-of-the-art performance on existing datasets.
Local Relationship Learning With Person-Specific Shape Regularization for Facial Action Unit Detection	Xuesong Niu,  Hu Han,  Songfan Yang,  Yan Huang,  Shiguang Shan; Proceedings of the IEEE/CVF Conference on Computer Vision and Pattern Recognition (CVPR), 2019, pp. 11917-11926	https://openaccess.thecvf.com/content_CVPR_2019/papers/Niu_Local_Relationship_Learning_With_Person-Specific_Shape_Regularization_for_Facial_Action_CVPR_2019_paper.pdf	Encoding individual facial expressions via action units (AUs) coded by the Facial Action Coding System (FACS) has been found to be an effective approach in resolving the ambiguity issue among different expressions. While a number of methods have been proposed for AU detection, robust AU detection in the wild remains a challenging problem because of the diverse baseline AU intensities across individual subjects, and the weakness of appearance signal of AUs. To resolve these issues, in this work, we propose a novel AU detection method by utilizing local information and the relationship of individual local face regions. Through such a local relationship learning, we expect to utilize rich local information to improve the AU detection robustness against the potential perceptual inconsistency of individual local regions. In addition, considering the diversity in the baseline AU intensities of individual subjects, we further regularize local relationship learning via person-specific face shape information, i.e., reducing the influence of person-specific shape information, and obtaining more AU discriminative features. The proposed approach outperforms the state-of-the-art methods on two widely used AU detection datasets in the public domain (BP4D and DISFA).
