ArcFace: Additive Angular Margin Loss for Deep Face Recognition	Jiankang Deng,  Jia Guo,  Niannan Xue,  Stefanos Zafeiriou; Proceedings of the IEEE/CVF Conference on Computer Vision and Pattern Recognition (CVPR), 2019, pp. 4690-4699	https://openaccess.thecvf.com/content_CVPR_2019/papers/Deng_ArcFace_Additive_Angular_Margin_Loss_for_Deep_Face_Recognition_CVPR_2019_paper.pdf	One of the main challenges in feature learning using Deep Convolutional Neural Networks (DCNNs) for large-scale face recognition is the design of appropriate loss functions that can enhance the discriminative power. Centre loss penalises the distance between deep features and their corresponding class centres in the Euclidean space to achieve intra-class compactness. SphereFace assumes that the linear transformation matrix in the last fully connected layer can be used as a representation of the class centres in the angular space and therefore penalises the angles between deep features and their corresponding weights in a multiplicative way. Recently, a popular line of research is to incorporate margins in well-established loss functions in order to maximise face class separability. In this paper, we propose an Additive Angular Margin Loss (ArcFace) to obtain highly discriminative features for face recognition. The proposed ArcFace has a clear geometric interpretation due to its exact correspondence to geodesic distance on a hypersphere. We present arguably the most extensive experimental evaluation against all recent state-of-the-art face recognition methods on ten face recognition benchmarks which includes a new large-scale image database with trillions of pairs and a large-scale video dataset. We show that ArcFace consistently outperforms the state of the art and can be easily implemented with negligible computational overhead. To facilitate future research, the code has been made available.
DSFD: Dual Shot Face Detector	Jian Li,  Yabiao Wang,  Changan Wang,  Ying Tai,  Jianjun Qian,  Jian Yang,  Chengjie Wang,  Jilin Li,  Feiyue Huang; Proceedings of the IEEE/CVF Conference on Computer Vision and Pattern Recognition (CVPR), 2019, pp. 5060-5069	https://openaccess.thecvf.com/content_CVPR_2019/papers/Li_DSFD_Dual_Shot_Face_Detector_CVPR_2019_paper.pdf	Recently, Convolutional Neural Network (CNN) has achieved great success in face detection. However, it remains a challenging problem for the current face detection methods owing to high degree of variability in scale, pose, occlusion, expression, appearance and illumination. In this Paper, we propose a novel detection network named Dual Shot face Detector(DSFD). which inherits the architecture of SSD and introduces a Feature Enhance Module (FEM) for transferring the original feature maps to extend the single shot detector to dual shot detector. Specially, progressive anchor loss (PAL) computed by using two set of anchors is adopted to effectively facilitate the features. Additionally, we propose an improved anchor matching (IAM) method by integrating novel data augmentation techniques and anchor design strategy in our DSFD to provide better initialization for the regressor. Extensive experiments on popular benchmarks: WIDER FACE (easy: 0.966, medium: 0.957, hard: 0.904) and FDDB ( discontinuous: 0.991, continuous: 0.862 ) demonstrate the superiority of DSFD over the state-of-the-art face detection methods (e.g., PyramidBox and SRN). Code will be made available upon publication.
Face Parsing With RoI Tanh-Warping	Jinpeng Lin,  Hao Yang,  Dong Chen,  Ming Zeng,  Fang Wen,  Lu Yuan; Proceedings of the IEEE/CVF Conference on Computer Vision and Pattern Recognition (CVPR), 2019, pp. 5654-5663	https://openaccess.thecvf.com/content_CVPR_2019/papers/Lin_Face_Parsing_With_RoI_Tanh-Warping_CVPR_2019_paper.pdf	Face parsing computes pixel-wise label maps for different semantic components (e.g., hair, mouth, eyes) from face images. Existing face parsing literature have illustrated significant advantages by focusing on individual regions of interest (RoIs) for faces and facial components. However,the traditional crop-and-resize focusing mechanism ignores all contextual area outside the RoIs, and thus is not suitable when the component area is unpredictable, e.g. hair. Inspired by the physiological vision system of human, we propose a novel RoI Tanh-warping operator that combines the central vision and the peripheral vision together. It addresses the dilemma between a limited sized RoI for focusing and an unpredictable area of surrounding context for peripheral information. To this end, we propose a novel hybrid convolutional neural network for face parsing. It uses hierarchical local based method for inner facial components and global methods for outer facial components. The whole framework is simple and principled, and can be trained end-to-end. To facilitate future research of face parsing, we also manually relabel the training data of the HELEN dataset and will make it public. Experiments on both HELEN and LFW-PL benchmarks demonstrate that our method surpasses state-of-the-art methods.
A Compact Embedding for Facial Expression Similarity	Raviteja Vemulapalli,  Aseem Agarwala; Proceedings of the IEEE/CVF Conference on Computer Vision and Pattern Recognition (CVPR), 2019, pp. 5683-5692	https://openaccess.thecvf.com/content_CVPR_2019/papers/Vemulapalli_A_Compact_Embedding_for_Facial_Expression_Similarity_CVPR_2019_paper.pdf	Most of the existing work on automatic facial expression analysis focuses on discrete emotion recognition, or facial action unit detection. However, facial expressions do not always fall neatly into pre-defined semantic categories. Also, the similarity between expressions measured in the action unit space need not correspond to how humans perceive expression similarity. Different from previous work, our goal is to describe facial expressions in a continuous fashion using a compact embedding space that mimics human visual preferences. To achieve this goal, we collect a large-scale faces-in-the-wild dataset with human annotations in the form: Expressions A and B are visually more similar when compared to expression C, and use this dataset to train a neural network that produces a compact (16-dimensional) expression embedding. We experimentally demonstrate that the learned embedding can be successfully used for various applications such as expression retrieval, photo album summarization, and emotion recognition. We also show that the embedding learned using the proposed dataset performs better than several other embeddings learned using existing emotion or action unit datasets.
Feature Transfer Learning for Face Recognition With Under-Represented Data	Xi Yin,  Xiang Yu,  Kihyuk Sohn,  Xiaoming Liu,  Manmohan Chandraker; Proceedings of the IEEE/CVF Conference on Computer Vision and Pattern Recognition (CVPR), 2019, pp. 5704-5713	https://openaccess.thecvf.com/content_CVPR_2019/papers/Yin_Feature_Transfer_Learning_for_Face_Recognition_With_Under-Represented_Data_CVPR_2019_paper.pdf	Despite the large volume of face recognition datasets, there is a significant portion of subjects, of which the samples are insufficient and thus under-represented. Ignoring such significant portion results in insufficient training data. Training with under-represented data leads to biased classifiers in conventionally-trained deep networks. In this paper, we propose a center-based feature transfer framework to augment the feature space of under-represented subjects from the regular subjects that have sufficiently diverse samples. A Gaussian prior of the variance is assumed across all subjects and the variance from regular ones are transferred to the under-represented ones. This encourages the under-represented distribution to be closer to the regular distribution. Further, an alternating training regimen is proposed to simultaneously achieve less biased classifiers and a more discriminative feature representation. We conduct ablative study to mimic the under-represented datasets by varying the portion of under-represented classes on the MS-Celeb-1M dataset. Advantageous results on LFW, IJB-A and MS-Celeb-1M demonstrate the effectiveness of our feature transfer and training strategy, compared to both general baselines and state-of-the-art methods. Moreover, our feature transfer successfully presents smooth visual interpolation, which conducts disentanglement to preserve identity of a class while augmenting its feature space with non-identity variations such as pose and lighting.
Led3D: A Lightweight and Efficient Deep Approach to Recognizing Low-Quality 3D Faces	Guodong Mu,  Di Huang,  Guosheng Hu,  Jia Sun,  Yunhong Wang; Proceedings of the IEEE/CVF Conference on Computer Vision and Pattern Recognition (CVPR), 2019, pp. 5773-5782	https://openaccess.thecvf.com/content_CVPR_2019/papers/Mu_Led3D_A_Lightweight_and_Efficient_Deep_Approach_to_Recognizing_Low-Quality_CVPR_2019_paper.pdf	Due to the intrinsic invariance to pose and illumination changes, 3D Face Recognition (FR) has a promising potential in the real world. 3D FR using high-quality faces, which are of high resolutions and with smooth surfaces, have been widely studied. However, research on that with low-quality input is limited, although it involves more applications. In this paper, we focus on 3D FR using low-quality data, targeting an efficient and accurate deep learning solution. To achieve this, we work on two aspects: (1) designing a lightweight yet powerful CNN; (2) generating finer and bigger training data. For (1), we propose a Multi-Scale Feature Fusion (MSFF) module and a Spatial Attention Vectorization (SAV) module to build a compact and discriminative CNN. For (2), we propose a data processing system including point-cloud recovery, surface refinement, and data augmentation (with newly proposed shape jittering and shape scaling). We conduct extensive experiments on Lock3DFace and achieve state-of-the-art results, outperforming many heavy CNNs such as VGG-16 and ResNet-34. In addition, our model can operate at a very high speed (136 fps) on Jetson TX2, and the promising accuracy and efficiency reached show its great applicability on edge/mobile devices.
Speech2Face: Learning the Face Behind a Voice	Tae-Hyun Oh,  Tali Dekel,  Changil Kim,  Inbar Mosseri,  William T. Freeman,  Michael Rubinstein,  Wojciech Matusik; Proceedings of the IEEE/CVF Conference on Computer Vision and Pattern Recognition (CVPR), 2019, pp. 7539-7548	https://openaccess.thecvf.com/content_CVPR_2019/papers/Oh_Speech2Face_Learning_the_Face_Behind_a_Voice_CVPR_2019_paper.pdf	How much can we infer about a person's looks from the way they speak? In this paper, we study the task of reconstructing a facial image of a person from a short audio recording of that person speaking. We design and train a deep neural network to perform this task using millions of natural Internet/Youtube videos of people speaking. During training, our model learns voice-face correlations that allow it to produce images that capture various physical attributes of the speakers such as age, gender and ethnicity. This is done in a self-supervised manner, by utilizing the natural co-occurrence of faces and speech in Internet videos, without the need to model attributes explicitly. We evaluate and numerically quantify how--and in what manner--our Speech2Face reconstructions, obtained directly from audio, resemble the true face images of the speakers.
MMFace: A Multi-Metric Regression Network for Unconstrained Face Reconstruction	Hongwei Yi,  Chen Li,  Qiong Cao,  Xiaoyong Shen,  Sheng Li,  Guoping Wang,  Yu-Wing Tai; Proceedings of the IEEE/CVF Conference on Computer Vision and Pattern Recognition (CVPR), 2019, pp. 7663-7672	https://openaccess.thecvf.com/content_CVPR_2019/papers/Yi_MMFace_A_Multi-Metric_Regression_Network_for_Unconstrained_Face_Reconstruction_CVPR_2019_paper.pdf	We propose to address the face reconstruction in the wild by using a multi-metric regression network, MMFace, to align a 3D face morphable model (3DMM) to an input image. The key idea is to utilize a volumetric sub-network to estimate an intermediate geometry representation, and a parametric sub-network to regress the 3DMM parameters. Our parametric sub-network consists of identity loss, expression loss, and pose loss which greatly improves the aligned geometry details by incorporating high level loss functions directly defined in the 3DMM parametric spaces. Our high-quality reconstruction is robust under large variations of expressions, poses, illumination conditions, and even with large partial occlusions. We evaluate our method by comparing the performance with state-of-the-art approaches on latest 3D face dataset LS3D-W and Florence. We achieve significant improvements both quantitatively and qualitatively. Due to our high-quality reconstruction, our method can be easily extended to generate high-quality geometry sequences for video inputs.
Efficient Decision-Based Black-Box Adversarial Attacks on Face Recognition	Yinpeng Dong,  Hang Su,  Baoyuan Wu,  Zhifeng Li,  Wei Liu,  Tong Zhang,  Jun Zhu; Proceedings of the IEEE/CVF Conference on Computer Vision and Pattern Recognition (CVPR), 2019, pp. 7714-7722	https://openaccess.thecvf.com/content_CVPR_2019/papers/Dong_Efficient_Decision-Based_Black-Box_Adversarial_Attacks_on_Face_Recognition_CVPR_2019_paper.pdf	Face recognition has obtained remarkable progress in recent years due to the great improvement of deep convolutional neural networks (CNNs). However, deep CNNs are vulnerable to adversarial examples, which can cause fateful consequences in real-world face recognition applications with security-sensitive purposes. Adversarial attacks are widely studied as they can identify the vulnerability of the models before they are deployed. In this paper, we evaluate the robustness of state-of-the-art face recognition models in the decision-based black-box attack setting, where the attackers have no access to the model parameters and gradients, but can only acquire hard-label predictions by sending queries to the target model. This attack setting is more practical in real-world face recognition systems. To improve the efficiency of previous methods, we propose an evolutionary attack algorithm, which can model the local geometry of the search directions and reduce the dimension of the search space. Extensive experiments demonstrate the effectiveness of the proposed method that induces a minimum perturbation to an input face image with fewer queries. We also apply the proposed method to attack a real-world face recognition system successfully.
FA-RPN: Floating Region Proposals for Face Detection	Mahyar Najibi,  Bharat Singh,  Larry S. Davis; Proceedings of the IEEE/CVF Conference on Computer Vision and Pattern Recognition (CVPR), 2019, pp. 7723-7732	https://openaccess.thecvf.com/content_CVPR_2019/papers/Najibi_FA-RPN_Floating_Region_Proposals_for_Face_Detection_CVPR_2019_paper.pdf	We propose a novel approach for generating region proposals for performing face detection. Instead of classifying anchor boxes using features from a pixel in the convolutional feature map, we adopt a pooling-based approach for generating region proposals. However, pooling hundreds of thousands of anchors which are evaluated for generating proposals becomes a computational bottleneck during inference. To this end, an efficient anchor placement strategy for reducing the number of anchor-boxes is proposed. We then show that proposals generated by our network (Floating Anchor Region Proposal Network, FA-RPN) are better than RPN for generating region proposals for face detection. We discuss several beneficial features of FA-RPN proposals (which can be enabled without re-training) like iterative refinement, placement of fractional anchors and changing size/shape of anchors. Our face detector based on FA-RPN obtains 89.4% mAP with a ResNet-50 backbone on the WIDER dataset.
Learning to Regress 3D Face Shape and Expression From an Image Without 3D Supervision	Soubhik Sanyal,  Timo Bolkart,  Haiwen Feng,  Michael J. Black; Proceedings of the IEEE/CVF Conference on Computer Vision and Pattern Recognition (CVPR), 2019, pp. 7763-7772	https://openaccess.thecvf.com/content_CVPR_2019/papers/Sanyal_Learning_to_Regress_3D_Face_Shape_and_Expression_From_an_CVPR_2019_paper.pdf	The estimation of 3D face shape from a single image must be robust to variations in lighting, head pose, expression, facial hair, makeup, and occlusions. Robustness requires a large training set of in-the-wild images, which by construction, lack ground truth 3D shape. To train a network without any 2D-to-3D supervision, we present RingNet, which learns to compute 3D face shape from a single image. Our key observation is that an individual's face shape is constant across images, regardless of expression, pose, lighting, etc. RingNet leverages multiple images of a person and automatically detected 2D face features. It uses a novel loss that encourages the face shape to be similar when the identity is the same and different for different people. We achieve invariance to expression by representing the face using the FLAME model. Once trained, our method takes a single image and outputs the parameters of FLAME, which can be readily animated. Additionally we create a new database of faces "not quite in-the-wild" (NoW) with 3D head scans and high-resolution images of the subjects in a wide variety of conditions. We evaluate publicly available methods and find that RingNet is more accurate than methods that use 3D supervision. The dataset, model, and results are available for research purposes at http://ringnet.is.tuebingen.mpg.de.
Face-Focused Cross-Stream Network for Deception Detection in Videos	Mingyu Ding,  An Zhao,  Zhiwu Lu,  Tao Xiang,  Ji-Rong Wen; Proceedings of the IEEE/CVF Conference on Computer Vision and Pattern Recognition (CVPR), 2019, pp. 7802-7811	https://openaccess.thecvf.com/content_CVPR_2019/papers/Ding_Face-Focused_Cross-Stream_Network_for_Deception_Detection_in_Videos_CVPR_2019_paper.pdf	Automated deception detection (ADD) from real-life videos is a challenging task. It specifically needs to address two problems:  (1) Both face and body contain useful cues regarding whether a subject is deceptive. How to effectively fuse the two is thus key to the effectiveness of an ADD model. (2) Real-life deceptive samples are hard to collect; learning with limited training data thus challenges most deep learning based ADD models. In this work, both problems are addressed. Specifically, for face-body multimodal learning, a novel face-focused cross-stream network (FFCSN) is proposed. It differs significantly from the popular two-stream networks in that: (a) face detection is added into the spatial stream to capture the facial expressions explicitly, and (b) correlation learning is performed across the spatial and temporal streams for joint deep feature learning across both face and body. To address the training data scarcity problem, our FFCSN model is trained with both meta learning and adversarial learning. Extensive experiments show that our FFCSN model achieves state-of-the-art results. Further, the proposed FFCSN model as well as its robust training strategy are shown to be generally applicable to other human-centric video analysis tasks such as emotion recognition from user-generated videos.
Unequal-Training for Deep Face Recognition With Long-Tailed Noisy Data	Yaoyao Zhong,  Weihong Deng,  Mei Wang,  Jiani Hu,  Jianteng Peng,  Xunqiang Tao,  Yaohai Huang; Proceedings of the IEEE/CVF Conference on Computer Vision and Pattern Recognition (CVPR), 2019, pp. 7812-7821	https://openaccess.thecvf.com/content_CVPR_2019/papers/Zhong_Unequal-Training_for_Deep_Face_Recognition_With_Long-Tailed_Noisy_Data_CVPR_2019_paper.pdf	Large-scale face datasets usually exhibit a massive number of classes, a long-tailed distribution, and severe label noise, which undoubtedly aggravate the difficulty of training. In this paper, we propose a training strategy that treats the head data and the tail data in an unequal way, accompanying with noise-robust loss functions, to take full advantage of their respective characteristics. Specifically, the unequal-training framework provides two training data streams: the first stream applies the head data to learn discriminative face representation supervised by Noise Resistance loss; the second stream applies the tail data to learn auxiliary information by gradually mining the stable discriminative information from confusing tail classes. Consequently, both training streams offer complementary information to deep feature learning. Extensive experiments have demonstrated the effectiveness of the new unequal-training framework and loss functions. Better yet, our method could save a significant amount of GPU memory. With our method, we achieve the best result on MegaFace Challenge 2 (MF2) given a large-scale noisy training data set.
Robust Subspace Clustering With Independent and Piecewise Identically Distributed Noise Modeling	Yuanman Li,  Jiantao Zhou,  Xianwei Zheng,  Jinyu Tian,  Yuan Yan Tang; Proceedings of the IEEE/CVF Conference on Computer Vision and Pattern Recognition (CVPR), 2019, pp. 8720-8729	https://openaccess.thecvf.com/content_CVPR_2019/papers/Li_Robust_Subspace_Clustering_With_Independent_and_Piecewise_Identically_Distributed_Noise_CVPR_2019_paper.pdf	Most of the existing subspace clustering (SC) frameworks assume that the noise contaminating the data is generated by an independent and identically distributed (i.i.d.) source, where the Gaussianity is often imposed. Though these assumptions greatly simplify the underlying problems, they do not hold in many real-world applications. For instance, in face clustering, the noise is usually caused by random occlusions, local variations and unconstrained illuminations, which is essentially structural and hence satisfies neither the i.i.d. property nor the Gaussianity.  In this work, we propose an independent and piecewise identically distributed (i.p.i.d.) noise model, where the i.i.d. property only holds locally. We demonstrate that the i.p.i.d. model better characterizes the noise encountered in practical scenarios, and accommodates the traditional i.i.d. model as a special case. Assisted by this generalized noise model, we design an information theoretic learning (ITL) framework for robust SC through a novel minimum weighted error entropy (MWEE) criterion. Extensive experimental results show that our proposed SC scheme significantly outperforms the state-of-the-art competing algorithms.
Joint Face Detection and Facial Motion Retargeting for Multiple Faces	Bindita Chaudhuri,  Noranart Vesdapunt,  Baoyuan Wang; Proceedings of the IEEE/CVF Conference on Computer Vision and Pattern Recognition (CVPR), 2019, pp. 9719-9728	https://openaccess.thecvf.com/content_CVPR_2019/papers/Chaudhuri_Joint_Face_Detection_and_Facial_Motion_Retargeting_for_Multiple_Faces_CVPR_2019_paper.pdf	Facial motion retargeting is an important problem in both computer graphics and vision, which involves capturing the performance of a human face and transferring it to another 3D character. Learning 3D morphable model (3DMM) parameters from 2D face images using convolutional neural networks is common in 2D face alignment, 3D face reconstruction etc. However, existing methods either require an additional face detection step before retargeting or use a cascade of separate networks to perform detection followed by retargeting in a sequence. In this paper, we present a single end-to-end network to jointly predict the bounding box locations and 3DMM parameters for multiple faces. First, we design a novel multitask learning framework that learns a disentangled representation of 3DMM parameters for a single face. Then, we leverage the trained single face model to generate ground truth 3DMM parameters for multiple faces to train another network that performs joint face detection and motion retargeting for images with multiple faces. Experimental results show that our joint detection and retargeting network has high face detection accuracy and is robust to extreme expressions and poses while being faster than state-of-the-art methods.
3D Guided Fine-Grained Face Manipulation	Zhenglin Geng,  Chen Cao,  Sergey Tulyakov; Proceedings of the IEEE/CVF Conference on Computer Vision and Pattern Recognition (CVPR), 2019, pp. 9821-9830	https://openaccess.thecvf.com/content_CVPR_2019/papers/Geng_3D_Guided_Fine-Grained_Face_Manipulation_CVPR_2019_paper.pdf	We present a method for fine-grained face manipulation. Given a face image with an arbitrary expression, our method can synthesize another arbitrary expression by the same person. This is achieved by first fitting a 3D face model and then disentangling the face into a texture and a shape. We then learn different networks in these two spaces. In the texture space, we use a conditional generative network to change the appearance, and carefully design input formats and loss functions to achieve the best results. In the shape space, we use a fully connected network to predict the accurate shapes and use the available depth data for supervision. Both networks are conditioned on expression coefficients rather than discrete labels, allowing us to generate an unlimited amount of expressions. We show the superiority of this disentangling approach through both quantitative and qualitative studies. In a user study, our method is preferred in 85% of cases when compared to the most recent work. When compared to the ground truth, annotators cannot reliably distinguish between our synthesized images and real images, preferring our method in 53% of the cases.
