Pixel Codec Avatars	Shugao Ma, Tomas Simon, Jason Saragih, Dawei Wang, Yuecheng Li, Fernando De la Torre, Yaser Sheikh; Proceedings of the IEEE/CVF Conference on Computer Vision and Pattern Recognition (CVPR), 2021, pp. 64-73	https://openaccess.thecvf.com/content/CVPR2021/papers/Ma_Pixel_Codec_Avatars_CVPR_2021_paper.pdf	Telecommunication with photorealistic avatars in virtual or augmented reality is a promising path for achieving authentic face-to-face communication in 3D over remote physical distances. In this work, we present the Pixel Codec Avatars (PiCA): a deep generative model of 3D human faces that achieves state of the art reconstruction performance while being computationally efficient and adaptive to the rendering conditions during execution. Our model combines two core ideas: (1) a fully convolutional architecture for decoding spatially varying features, and (2) a rendering-adaptive per-pixel decoder. Both techniques are integrated via a dense surface representation that is learned in a weakly-supervised manner from low-topology mesh tracking over training images. We demonstrate that PiCA improves reconstruction over existing techniques across testing expressions and views on persons of different gender and skin tone. Importantly, we show that the PiCA model is much smaller than the state-of-art baseline model, and makes multi-person telecommunicaiton possible: on a single Oculus Quest 2 mobile VR headset, 5 avatars are rendered in realtime in the same scene.
CRFace: Confidence Ranker for Model-Agnostic Face Detection Refinement	Noranart Vesdapunt, Baoyuan Wang; Proceedings of the IEEE/CVF Conference on Computer Vision and Pattern Recognition (CVPR), 2021, pp. 1674-1684	https://openaccess.thecvf.com/content/CVPR2021/papers/Vesdapunt_CRFace_Confidence_Ranker_for_Model-Agnostic_Face_Detection_Refinement_CVPR_2021_paper.pdf	Face detection is a fundamental problem for many downstream face applications, and there is a rising demand for faster, more accurate yet support for higher resolution face detectors. Recent smartphones can record a video in 8K resolution, but many of the existing face detectors still fail due to the anchor size and training data. We analyze the failure cases and observe a large number of correct predicted boxes with incorrect confidences. To calibrate these confidences, we propose a confidence ranking network with a pairwise ranking loss to re-rank the predicted confidences locally within the same image. Our confidence ranker is model-agnostic, so we can augment the data by choosing the pairs from multiple face detectors during the training, and generalize to a wide range of face detectors during the testing. On WiderFace, we achieve the highest AP on the single-scale, and our AP is competitive with the previous multi-scale methods while being significantly faster. On 8K resolution, our method solves the GPU memory issue and allows us to indirectly train on 8K. We collect 8K resolution test set to show the improvement, and we will release our test set as a new benchmark for future research.
Pseudo Facial Generation With Extreme Poses for Face Recognition	Guoli Wang, Jiaqi Ma, Qian Zhang, Jiwen Lu, Jie Zhou; Proceedings of the IEEE/CVF Conference on Computer Vision and Pattern Recognition (CVPR), 2021, pp. 1994-2003	https://openaccess.thecvf.com/content/CVPR2021/papers/Wang_Pseudo_Facial_Generation_With_Extreme_Poses_for_Face_Recognition_CVPR_2021_paper.pdf	Face recognition has achieved a great success in recent years, it is still challenging to recognize those facial images with extreme poses. Traditional methods consider it as a domain gap problem. Many of them settle it by generating fake frontal faces from extreme ones, whereas they are tough to maintain the identity information with high computational consumption and uncontrolled disturbances. Our experimental analysis shows a dramatic precision drop with extreme poses. Meanwhile, those extreme poses just exist minor visual differences after small rotations. Derived from this insight, we attempt to relieve such a huge precision drop by making minor changes to the input images without modifying existing discriminators. A novel lightweight pseudo facial generation is proposed to relieve the problem of extreme poses without generating any frontal facial image. It can depict the facial contour information and make appropriate modifications to preserve the critical identity information. Specifically, the proposed method reconstructs pseudo profile faces by minimizing the pixel-wise differences with original profile faces and maintaining the identity consistent information from their corresponding frontal faces simultaneously. The proposed framework can improve existing discriminators and obtain a great promotion on several benchmark datasets.
GAN Prior Embedded Network for Blind Face Restoration in the Wild	Tao Yang, Peiran Ren, Xuansong Xie, Lei Zhang; Proceedings of the IEEE/CVF Conference on Computer Vision and Pattern Recognition (CVPR), 2021, pp. 672-681	https://openaccess.thecvf.com/content/CVPR2021/papers/Yang_GAN_Prior_Embedded_Network_for_Blind_Face_Restoration_in_the_CVPR_2021_paper.pdf	Blind face restoration (BFR) from severely degraded face images in the wild is a very challenging problem. Due to the high illness of the problem and the complex unknown degradation, directly training a deep neural network (DNN) usually cannot lead to acceptable results. Existing generative adversarial network (GAN) based methods can produce better results but tend to generate over-smoothed restorations. In this work, we propose a new method by first learning a GAN for high-quality face image generation and embedding it into a U-shaped DNN as a prior decoder, then fine-tuning the GAN prior embedded DNN with a set of synthesized low-quality face images. The GAN blocks are designed to ensure that the latent code and noise input to the GAN can be respectively generated from the deep and shallow features of the DNN, controlling the global face structure, local face details and background of the reconstructed image. The proposed GAN prior embedded network (GPEN) is easy-to-implement, and it can generate visually photo-realistic results. Our experiments demonstrated that the proposed GPEN achieves significantly superior results to state-of-the-art BFR methods both quantitatively and qualitatively, especially for the restoration of severely degraded face images in the wild. The source code and models can be found at https://github.com/yangxy/GPEN.
Pareidolia Face Reenactment	Linsen Song, Wayne Wu, Chaoyou Fu, Chen Qian, Chen Change Loy, Ran He; Proceedings of the IEEE/CVF Conference on Computer Vision and Pattern Recognition (CVPR), 2021, pp. 2236-2245	https://openaccess.thecvf.com/content/CVPR2021/papers/Song_Pareidolia_Face_Reenactment_CVPR_2021_paper.pdf	We present a new application direction named Pareidolia Face Reenactment, which is defined as animating a static illusory face to move in tandem with a human face in the video. For the large differences between pareidolia face reenactment and traditional human face reenactment, two main challenges are introduced, i.e., shape variance and texture variance. In this work, we propose a novel Parametric Unsupervised Reenactment Algorithm to tackle these two challenges. Specifically, we propose to decompose the reenactment into three catenate processes: shape modeling, motion transfer and texture synthesis. With the decomposition, we introduce three crucial components, i.e., Parametric Shape Modeling, Expansionary Motion Transfer and Unsupervised Texture Synthesizer, to overcome the problems brought by the remarkably variances on pareidolia faces. Extensive experiments show the superior performance of our method both qualitatively and quantitatively. Code, model and data are available on our project page.
Consistent Instance False Positive Improves Fairness in Face Recognition	Xingkun Xu, Yuge Huang, Pengcheng Shen, Shaoxin Li, Jilin Li, Feiyue Huang, Yong Li, Zhen Cui; Proceedings of the IEEE/CVF Conference on Computer Vision and Pattern Recognition (CVPR), 2021, pp. 578-586	https://openaccess.thecvf.com/content/CVPR2021/papers/Xu_Consistent_Instance_False_Positive_Improves_Fairness_in_Face_Recognition_CVPR_2021_paper.pdf	Demographic bias is a significant challenge in practical face recognition systems. Several methods have been proposed to reduce the bias, which rely on accurate demographic annotations. However, such annotations are usually not available in real scenarios. Moreover, these methods are explicitly designed for a specific demographic group divided by a predefined attribute, which is typically not general across different demographic groups divided by various attributes, such as race, gender, and age. In this paper, we propose a false positive rate penalty loss, which mitigates face recognition bias by increasing the consistency of instance false positive rate (FPR). Specifically, we first define the instance FPR as the ratio between the number of the non-target similarities above a unified threshold and the total number of the non-target similarities. The unified threshold is estimated for a given total FPR. Then, we introduce an additional false positive penalty term into the softmaxbased losses to promote the consistency of instance FPRs. Compared with the previous debiasing methods, our method requires no demographic annotations and can mitigate the bias across demographic groups divided by various kinds of attribute which are no need to be predefined in training. Extensive experimental results on popular benchmarks demonstrate the superiority of our method over state-of-the art competitors.
Monocular Reconstruction of Neural Face Reflectance Fields	Mallikarjun B R, Ayush Tewari, Tae-Hyun Oh, Tim Weyrich, Bernd Bickel, Hans-Peter Seidel, Hanspeter Pfister, Wojciech Matusik, Mohamed Elgharib, Christian Theobalt; Proceedings of the IEEE/CVF Conference on Computer Vision and Pattern Recognition (CVPR), 2021, pp. 4791-4800	https://openaccess.thecvf.com/content/CVPR2021/papers/R_Monocular_Reconstruction_of_Neural_Face_Reflectance_Fields_CVPR_2021_paper.pdf	The reflectance field of a face describes the reflectance properties responsible for complex lighting effects including diffuse, specular, inter-reflection and self shadowing. Most existing methods for estimating the face reflectance from a monocular image assume faces to be diffuse with very few approaches adding a specular component. This still leaves out important perceptual aspects of reflectance such as higher-order global illumination effects and self-shadowing. We present a new neural representation for face reflectance where we can estimate all components of the reflectance responsible for the final appearance from a monocular image. Instead of modeling each component of the reflectance separately using parametric models, our neural representation allows us to generate a basis set of faces in a geometric deformation-invariant space, parameterized by the input light direction, viewpoint and face geometry. We learn to reconstruct this reflectance field of a face just from a monocular image, which can be used to render the face from any viewpoint in any light condition. Our method is trained on a light-stage dataset, which captures 300 people illuminated with 150 light conditions from 8 viewpoints. We show that our method outperforms existing monocular reflectance reconstruction methods due to better capturing of physical effects, such as sub-surface scattering, specularities, self-shadows and other higher-order effects.
Learning Complete 3D Morphable Face Models From Images and Videos	Mallikarjun B R, Ayush Tewari, Hans-Peter Seidel, Mohamed Elgharib, Christian Theobalt; Proceedings of the IEEE/CVF Conference on Computer Vision and Pattern Recognition (CVPR), 2021, pp. 3361-3371	https://openaccess.thecvf.com/content/CVPR2021/papers/R_Learning_Complete_3D_Morphable_Face_Models_From_Images_and_Videos_CVPR_2021_paper.pdf	Most 3D face reconstruction methods rely on 3D morphable models, which disentangle the space of facial deformations into identity and expression geometry, and skin reflectance. These models are typically learned from a limited number of 3D scans and thus do not generalize well across different identities and expressions. We present the first approach to learn complete 3D models of face identity and expression geometry, and reflectance, just from images and videos. The virtually endless collection of such data, in combination with our self-supervised learning-based approach allows for learning face models that generalize beyond the span of existing approaches. Our network design and loss functions ensure a disentangled parameterization of not only identity and albedo, but also, for the first time, an expression basis. Our method also allows for in-the-wild monocular reconstruction at test time. We show that our learned models better generalize and lead to higher quality image-based reconstructions than existing approaches. We show that the learned model can also be personalized to a video, for a better capture of the geometry and albedo.
Lips Don't Lie: A Generalisable and Robust Approach To Face Forgery Detection	Alexandros Haliassos, Konstantinos Vougioukas, Stavros Petridis, Maja Pantic; Proceedings of the IEEE/CVF Conference on Computer Vision and Pattern Recognition (CVPR), 2021, pp. 5039-5049	https://openaccess.thecvf.com/content/CVPR2021/papers/Haliassos_Lips_Dont_Lie_A_Generalisable_and_Robust_Approach_To_Face_CVPR_2021_paper.pdf	Although current deep learning-based face forgery detectors achieve impressive performance in constrained scenarios, they are vulnerable to samples created by unseen manipulation methods. Some recent works show improvements in generalisation but rely on cues that are easily corrupted by common post-processing operations such as compression. In this paper, we propose LipForensics, a detection approach capable of both generalising to novel manipulations and withstanding various distortions. LipForensics targets high-level semantic irregularities in mouth movements, which are common in many generated videos. It consists in first pretraining a spatio-temporal network to perform visual speech recognition (lipreading), thus learning rich internal representations related to natural mouth motion. A temporal network is subsequently finetuned on fixed mouth embeddings of real and forged data in order to detect fake videos based on mouth movements without overfitting to low-level, manipulation-specific artefacts. Extensive experiments show that this simple approach significantly surpasses the state-of-the-art in terms of generalisation to unseen manipulations and robustness to perturbations, as well as shed light on the factors responsible for its performance.
Monocular Real-Time Full Body Capture With Inter-Part Correlations	Yuxiao Zhou, Marc Habermann, Ikhsanul Habibie, Ayush Tewari, Christian Theobalt, Feng Xu; Proceedings of the IEEE/CVF Conference on Computer Vision and Pattern Recognition (CVPR), 2021, pp. 4811-4822	https://openaccess.thecvf.com/content/CVPR2021/papers/Zhou_Monocular_Real-Time_Full_Body_Capture_With_Inter-Part_Correlations_CVPR_2021_paper.pdf	We present the first method for real-time full body capture that estimates shape and motion of body and hands together with a dynamic 3D face model from a single color image. Our approach uses a new neural network architecture that exploits correlations between body and hands at high computational efficiency. Unlike previous works, our approach is jointly trained on multiple datasets focusing on hand, body or face separately, without requiring data where all the parts are annotated at the same time, which is much more difficult to create at sufficient variety. The possibility of such multi-dataset training enables superior generalization ability. In contrast to earlier monocular full body methods, our approach captures more expressive 3D face geometry and color by estimating the shape, expression, albedo and illumination parameters of a statistical face model. Our method achieves competitive accuracy on public benchmarks, while being significantly faster and providing more complete face reconstructions.
Backdoor Attacks Against Deep Learning Systems in the Physical World	Emily Wenger, Josephine Passananti, Arjun Nitin Bhagoji, Yuanshun Yao, Haitao Zheng, Ben Y. Zhao; Proceedings of the IEEE/CVF Conference on Computer Vision and Pattern Recognition (CVPR), 2021, pp. 6206-6215	https://openaccess.thecvf.com/content/CVPR2021/papers/Wenger_Backdoor_Attacks_Against_Deep_Learning_Systems_in_the_Physical_World_CVPR_2021_paper.pdf	Backdoor attacks embed hidden malicious behaviors into deep learning models, which only activate and cause misclassifications on model inputs containing a specific "trigger." Existing works on backdoor attacks and defenses, however, mostly focus on digital attacks that apply digitally generated patterns as triggers. A critical question remains unanswered: "can backdoor attacks succeed using physical objects as triggers, making them a credible threat against deep learning systems in the real world?" We conduct a detailed empirical study to explore this question for facial recognition, a critical deep learning task. Using 7 physical objects as triggers, we collect a custom dataset of 3205 images of 10 volunteers and use it to study the feasibility of "physical" backdoor attacks under a variety of real-world conditions. Our study reveals two key findings. First, physical backdoor attacks can be highly successful if they are carefully configured to overcome the constraints imposed by physical objects. In particular, the placement of successful triggers is largely constrained by the victim model's dependence on key facial features. Second, four of today's state-of-the-art defenses against (digital) backdoors are ineffective against physical backdoors, because the use of physical objects breaks core assumptions used to construct these defenses. Our study confirms that (physical) backdoor attacks are not a hypothetical phenomenon but rather pose a serious real-world threat to critical classification tasks. We need new and more robust defenses against backdoors in the physical world.
Mitigating Face Recognition Bias via Group Adaptive Classifier	Sixue Gong, Xiaoming Liu, Anil K. Jain; Proceedings of the IEEE/CVF Conference on Computer Vision and Pattern Recognition (CVPR), 2021, pp. 3414-3424	https://openaccess.thecvf.com/content/CVPR2021/papers/Gong_Mitigating_Face_Recognition_Bias_via_Group_Adaptive_Classifier_CVPR_2021_paper.pdf	Face recognition is known to exhibit bias -- subjects in a certain demographic group can be better recognized than other groups. This work aims to learn a fair face representation, where faces of every group could be more equally represented. Our proposed group adaptive classifier mitigates bias by using adaptive convolution kernels and attention mechanisms on faces based on their demographic attributes. The adaptive module comprises kernel masks and channel-wise attention maps for each demographic group so as to activate different facial regions for identification, leading to more discriminative features pertinent to their demographics. Our introduced automated adaptation strategy determines whether to apply adaptation to a certain layer by iteratively computing the dissimilarity among demographic-adaptive parameters. A new de-biasing loss function is proposed to mitigate the gap of average intra-class distance between demographic groups. Experiments on face benchmarks (RFW, LFW, IJB-A, and IJB-C) show that our work is able to mitigate face recognition bias across demographic groups while maintaining the competitive accuracy.
Dynamic Class Queue for Large Scale Face Recognition in the Wild	Bi Li, Teng Xi, Gang Zhang, Haocheng Feng, Junyu Han, Jingtuo Liu, Errui Ding, Wenyu Liu; Proceedings of the IEEE/CVF Conference on Computer Vision and Pattern Recognition (CVPR), 2021, pp. 3763-3772	https://openaccess.thecvf.com/content/CVPR2021/papers/Li_Dynamic_Class_Queue_for_Large_Scale_Face_Recognition_in_the_CVPR_2021_paper.pdf	Learning discriminative representation using large-scale face datasets in the wild is crucial for real-world applications, yet it remains challenging. The difficulties lie in many aspects and this work focus on computing resource constraint and long-tailed class distribution. Recently, classification-based representation learning with deep neural networks and well-designed losses have demonstrated good recognition performance. However, the computing and memory cost linearly scales up to the number of identities (classes) in the training set, and the learning process suffers from unbalanced classes. In this work, we propose a dynamic class queue (DCQ) to tackle these two problems. Specifically, for each iteration during training, a subset of classes for recognition are dynamically selected and their class weights are dynamically generated on-the-fly which are stored in a queue. Since only a subset of classes is selected for each iteration, the computing requirement is reduced. By using a single server without model parallel, we empirically verify in large-scale datasets that 10% of classes are sufficient to achieve similar performance as using all classes. Moreover, the class weights are dynamically generated in a few-shot manner and therefore suitable for tail classes with only a few instances. We show clear improvement over a strong baseline in the largest public dataset Megaface Challenge2 (MF2) which has 672K identities and over 88% of them have less than 10 instances. Code is available at https://github.com/bilylee/DCQ
Riggable 3D Face Reconstruction via In-Network Optimization	Ziqian Bai, Zhaopeng Cui, Xiaoming Liu, Ping Tan; Proceedings of the IEEE/CVF Conference on Computer Vision and Pattern Recognition (CVPR), 2021, pp. 6216-6225	https://openaccess.thecvf.com/content/CVPR2021/papers/Bai_Riggable_3D_Face_Reconstruction_via_In-Network_Optimization_CVPR_2021_paper.pdf	This paper presents a method for riggable 3D face reconstruction from monocular images, which jointly estimates a personalized face rig and per-image parameters including expressions, poses, and illuminations. To achieve this goal, we design an end-to-end trainable network embedded with a differentiable in-network optimization. The network first parameterizes the face rig as a compact latent code with a neural decoder, and then estimates the latent code as well as per-image parameters via a learnable optimization. By estimating a personalized face rig, our method goes beyond static reconstructions and enables downstream applications such as video retargeting. In-network optimization explicitly enforces constraints derived from the first principles, thus introduces additional priors than regression-based methods. Finally, data-driven priors from deep learning are utilized to constrain the ill-posed monocular setting and ease the optimization difficulty. Experiments demonstrate that our method achieves SOTA reconstruction accuracy, reasonable robustness and generalization ability, and supports standard face rig applications.
Face Forgery Detection by 3D Decomposition	Xiangyu Zhu, Hao Wang, Hongyan Fei, Zhen Lei, Stan Z. Li; Proceedings of the IEEE/CVF Conference on Computer Vision and Pattern Recognition (CVPR), 2021, pp. 2929-2939	https://openaccess.thecvf.com/content/CVPR2021/papers/Zhu_Face_Forgery_Detection_by_3D_Decomposition_CVPR_2021_paper.pdf	Detecting digital face manipulation has attracted extensive attention due to the potential harms of fake media to the public. However, recent advances have been able to reduce the forgery signals to a low magnitude. Decomposition, which reversibly decomposes the image into several constituent elements, is a promising way to highlight the hidden forgery details. In this paper, we consider a face image as the production of the intervention of the underlying 3D geometry and the lighting environment, and decompose it in a computer graphics view. Specifically, by disentangling the face image into 3D shape, common texture, identity texture, ambient light, and direct light, we find the devil lies in the direct light and the identity texture. Based on this observation, we propose to utilize facial detail, which is the combination of direct light and identity texture, as the clue to detect the subtle forgery patterns. Besides, we highlight the manipulated region with a supervised attention mechanism and introduce a two-stream structure to exploit both face image and facial detail together as a multi-modality task. Extensive experiments indicate the effectiveness of the extra features extracted from the facial detail, and our method achieves the state-of-the-art performance.
